text,category
Ahhh I love thunder storms in the summer,storm
"The aurora borealis could appear in New York, Chicago, and Portland on Wednesday, as solar storms crash into Earth https://t.co/Sr0seL74At",other
All tucked in for the thunderstorm. Gn. https://t.co/nVMGVePcYY,storm
"@AJ_Mullinz @PenrithPanthers 100% on the halves, they looked awful &amp; made Storms defence look unreal. We had no fluidity in attack &amp; literally looked worse then the tigers",other
"🌩 Mother Nature put on quite a show Wednesday night with lightning illuminating the skies over Arlington., 1
Full video: https://t.co/U731Qbtsek #NBCDFWWeather https://t.co/pXgtlo1So0",other
"June 01, 2014: Southwest #Kansas Severe #Thunderstorm https://t.co/Iec31UKxUo #stormtours #stormchasing #stormchase",storm
This thunderstorm 😍,storm
I just want to sit in a sunroom during a thunderstorm and do giant jigsaw puzzles while drinking tea...is that too much to ask,storm
"@wfaaweather Odd for the storms to be moving north, isn't it?",storm
Wow!! My 7 day plus 4 more from our 10PM Wednesday news! Cool the next 2 mornings! Warmer days and getting a bit hot into weekend. Scattered storms will be nearby PM Saturday thru AM Monday so stay positive!! #okwx #kfortv4 Mike 8.17.22 https://t.co/yLPjL8Q0o3,storm
Severe Thunderstorm Warning for the following counties/areas Pima until 17 Aug 8:00PM MST https://t.co/jRsXCDHD5d,storm
"GEOMAGNETIC STORMS, EARTHQUAKES on Something to Think About https://t.co/kxO7Yr30Js via @YouTube",other
Maintain positivity in the roughest storms because eventually calmer waters and sunshine are ahead.,other
"Messages From Spirit for August 18, 2022 ✨, 0

#Daily #Guidance #Message #MessagesFromSpirit #Aug18 #August18 #Rise #RiseAbove #Storms #Challenges #Adversity #Overcome #BeConsistent #Support #Experience #Life #LiveLifeToTheFullest #YouCanFly #Effo, 1rtlessly #DontBeAfraid #BeHappy https://t.co/78dm0pyE6v",other
Thunderstorm in the forecast for tmrw woah,storm
Back to the daily dousings for Acadiana thru the weekend w/a good chance of scattered showers/storms...no day looks to be complete washouts at this point but keep rain gear ready for activity at any time from the morning through the evening hours. https://t.co/jOQcXbbnHx #LAwx https://t.co/vAauDQtbvW,storm
"PSR expires Severe Thunderstorm Warning for La Paz, Yuma [AZ] https://t.co/oWzp7y9ggF https://t.co/JxgroO52nS",storm
"PSR expires Severe Thunderstorm Warning for La Paz, Yuma [AZ] https://t.co/DQVUW0dIsL https://t.co/jD5TXW7o2P",storm
"PSR expires Severe Thunderstorm Warning for La Paz, Yuma [AZ] https://t.co/C260feGQ60 https://t.co/n6Yjhyk2ru",storm
"PSR expires Severe Thunderstorm Warning for La Paz, Yuma [AZ] https://t.co/MqyJnPMqIf https://t.co/TGVHfs6vEp",storm
"PSR expires Severe Thunderstorm Warning for La Paz, Yuma [AZ] https://t.co/MYuHnsKOWv https://t.co/KvYs3V6fet",storm
NWS Alert&gt; Strong Thunderstorm 10 Miles NE of Yuma Proving Ground or 19 Miles NE of Martinez Lake Moving SE At 15 MPH. Wind Gusts to 50 MPH &amp; Small Hail. Gusty Winds Could Knock Down Tree Limbs &amp; Blow Around Unsecured... #azwx https://t.co/hlvHuJZOe3,storm
"A Severe Thunderstorm Warning is in effect until 8/17 10:30PM CDT.  If you are in the path of the storm, seek shelter and go to the lowest floor.  Stay away from windows and doors. #BEKNews #BEKWeather #NDWX #Warning https://t.co/3PUoOCIKpE",storm
It seems like a thunderstorm...but I'm not a meteorologist.,storm
Thursday will be hot and very humid with a few isolated sea-breeze showers or storms. Heat index values around 105.  Southerly breeze at 8-18 mph. https://t.co/KOelNMTb87,storm
"Day five (I think) of drawing something random until I get shot, 0

There was a thunderstorm and I spent 20 minutes taking a leisure walk to tempt god, sadly nothing amusing happened. https://t.co/2CE2YeKHCH",other
Oooouu I hear a thunderstorm coming ⛈🧘🏽‍♀️,storm
Ahh I love the sounds of nighttime storms. I'll be sleeping like a baby tonight. https://t.co/uAiuENlqgP,storm
"A strong thunderstorm will impact portions of southwestern La Paz and north central Yuma Counties through 900 PM MST [wind: 50 MPH, hail: 0.25 IN] for Gila River Valley, Kofa, Yuma [AZ] https://t.co/CIQeMiz0Z6 https://t.co/8CZVgTLFvT",storm
This thunder and lightning though… Texas storms are too much… 😂 https://t.co/ZYDGgYEXlI,storm
8/17 10:21pm: The Northern Lights will be *possible* 10pm-4am again on Thursday night/Friday AM. Get ready for a slight warm up for the last part of the week. Slight t-storm chance Friday. Greater chance for storms Saturday afternoon/evening and off-and-on Sunday. https://t.co/DiF234yFtB,storm
@babybunkook_ WTH but i didn’t though wth it has to be hot for it to b a thunderstorm??? WhY,storm
"POV: you and your partner are in bed, the sounds of love being drowned out by the gentle patter of the rainstorm outside, 0

you caress your partner tightly, drunk in ecstasy as the storm grows louder, before you know it you're in a tornado being transported to World 8 in Mario 3",other
"Do you see what I see?, 0
#RELIEF., 0
(Just stay weather aware Thursday afternoon when strong/severe storms -&gt; gusty winds will be possible along with low-end flood risk), 1
#atx #atxwx #cbsaustinwx, 0
https://t.co/rQni6ug3y4 https://t.co/6Ebc3aRzM3",other
We needed this thunderstorm and rain. ⛈,storm
"@yourladykc Hey LuvBug. 😘❤️😘, 0
Stay safe from the storms 🙏 💙 ✨️, 0 
Hope all is well with you and your family.",other
"#AK61 Firstlook will take thunderstorm, 1
response",other
@feisukanojo Storms and Waves https://t.co/dbLuYPrvcZ,storm
Sitting in the garage with the door half open enjoying this thunderstorm and a j.,storm
thunderstorm lighting up the sky https://t.co/0aqHb4gby2,storm
My Girl My World 🥺 Auntie Istg When I Lost You I Lost Myself Too. Since Your Passing Ive Been Going Thru The Storms Bad. I Try To Swim My Way Out But I Keep Drowning. But Honestly Since I Lost You My Life Been Nothing But A Dark Living Nightmare 😩😖 I Love You Sm 💔🫶🏽 https://t.co/5FL2dmanRP,other
@SylviaTheSnep @Shadumura @MabesLeonisoul Your explanation is both adequate and absolutely correct.,other
the hoodoo in me wants to take a shower but there’s a thunderstorm outside.,storm
"10:15pm - Very heavy rain and lots of lightning happening in D-FW. Watch out for localized flooding and standing water on the roadways. Severe storms are not likely over the next couple hours, but heavy rain will continue in places. #wfaaweather, 1

Radars: https://t.co/ji6YaxLBma https://t.co/rAFK6RY8dD",storm
"10:15pm - Very heavy rain and lots of lightning happening in D-FW. Watch out for localized flooding and standing water on the roadways. Severe storms are not likely over the next couple hours, but heavy rain will continue in places. #wfaaweather, 1

Radars: https://t.co/PyKreFAs8D https://t.co/Q8poXZy9qU",storm
@CoachAguirre08 Will practicing how to bring equipment inside quickly during a thunderstorm be part of the training this year? ⛈⚡️,storm
Dry lightening and thunderstorm tonight… pray for the wild land firefighters.,storm
LMAO OFC.... I GET TO SLEEP... THEN *BAM!* thunderstorm.....,storm
"Quickly moving towards the storm, moving forward, torn , 0
 Into pieces over reasons of what these storms are for",other
"""Storms make trees take deeper roots."" -Dolly Parton, 0

#Music",other
Time and time again people get upset at geomagnetic storms that didn’t come to happen at the right time right place. I personally don’t like to get my hopes up until right before hand because it is difficult to forecast CME arrivals and the world is chaotic. Anything could occur.,other
"NWS Alert&gt; Severe Thunderstorm 9 Miles E of Napoleon Moving E At 30 MPH. 60 MPH Wind Gusts, Penny Size Hail. Expect Damage to Roofs, Siding, &amp; Trees. Locations Impacted Include Napoleon, Streeter, Burnstad &amp; Beaver Lake... #ndwx https://t.co/43UIlzBZRi",storm
"I looked at the radar earlier and the storms south of me were moving south.  It just started lightning here, so i pulled the radar up and the storms are moving north now??? I’m sorry what just happened?",storm
"Severe Thunderstorm Warning continues for Napoleon ND, Streeter ND and  Burnstad ND until 10:30 PM CDT https://t.co/lHQZBlu73F",storm
"Severe Thunderstorm Warning continues for Napoleon ND, Streeter ND and  Burnstad ND until 10:30 PM CDT https://t.co/HK0XJhcloe",storm
"Spring and fall collide, 0
Storms on chilly August nights, 0
Summer steps aside, 0
#haiku #poetry #Minneapolis",other
"BIS updates Severe Thunderstorm Warning [wind: 60 MPH (RADAR INDICATED), hail: 0.75 IN (RADAR INDICATED)] (cancels Emmons [ND], continues Kidder, Logan, Stutsman [ND]) till 10:30 PM CDT https://t.co/wesc5PQmSi https://t.co/YZ3QEA0dap",storm
"BIS updates Severe Thunderstorm Warning [wind: 60 MPH (RADAR INDICATED), hail: 0.75 IN (RADAR INDICATED)] (cancels Emmons [ND], continues Kidder, Logan, Stutsman [ND]) till 10:30 PM CDT https://t.co/lAoUgnPO6b https://t.co/4YM51SQNQe",storm
"BIS updates Severe Thunderstorm Warning [wind: 60 MPH (RADAR INDICATED), hail: 0.75 IN (RADAR INDICATED)] (cancels Emmons [ND], continues Kidder, Logan, Stutsman [ND]) till 10:30 PM CDT https://t.co/BsyLE6RvR3 https://t.co/NnIB4PjETK",storm
"BIS updates Severe Thunderstorm Warning [wind: 60 MPH (RADAR INDICATED), hail: 0.75 IN (RADAR INDICATED)] (cancels Emmons [ND], continues Kidder, Logan, Stutsman [ND]) till 10:30 PM CDT https://t.co/ZQCboSumiM https://t.co/U2CgI2ozsa",storm
"BIS updates Severe Thunderstorm Warning [wind: 60 MPH (RADAR INDICATED), hail: 0.75 IN (RADAR INDICATED)] (cancels Emmons [ND], continues Kidder, Logan, Stutsman [ND]) till 10:30 PM CDT https://t.co/JJKHwMxAjX https://t.co/iMw3CBEbIp",storm
⁦@KHayhoe⁩ we aren’t supposed to get these kinds of storms in Alaska!  We all need to be concerned about climate change!https://t.co/ay8DjAQG2B,storm
@Mohan_Rngnathan @praddy06 @ChennaiRains @RainStorm_TN My mobile tower conked off. BSNL just said bleep.,storm
"@BexTheBard Note to me, avoid Bekka's house during storms. https://t.co/wvLi5k8bFQ",other
Wow an actual thunderstorm happening rn 😍,storm
"So glad it's our mountains!  Only a matter of time before we get smoke from somewhere else though., 0
Northeast Colorado is still hurting, they've missed out on most of the thunderstorm rains we've had near the mountains.,https://t.co/kINHvNXqCF",storm
Thunderstorm rolling into Vegas rn. https://t.co/HRL8mtAO6G,storm
"Thursday could start with patchy fog and a passing shower will be possible in the afternoon....but most of Thursday and Friday will be pleasant. Humid air and daily chances for showers and storms return by the weekend. The wettest days are likely to be Monday, Tuesday. https://t.co/M1xN0mbQ4w",storm
"""You will hear thunder and remember me,, 0
And think: she wanted storms. The rim, 0
Of the sky will be the colour of hard crimson,, 0
And your heart, as it was then, will be on fire."", 0
-- Anna Akhmatova , 0
I was just introduced to her #poetry, via my sister #storyteller, Adrien Lowery.",other
@CBS11Giles @CBSDFW @oncor I keep giving my dogs their anxiety pills because of severe thunderstorm warnings and nothing happens.  They’re going to be addicted soon.,storm
Storms ⛈ coming https://t.co/HHNFwRNuRH,storm
"@PlayboyCrusader away. I’ll make some soothing lavender and chamomile milk tea. All three are beneficial for sleep and good rest. It's still dark from our usual Gotham storms, and the soothing sound of the light rain trickling against the window. I’ll light a vanilla ~",other
"@Climatologist49 They do actually name them often by what holiday or whatnot they happened on, it. Halloween Storms of 2003 or Bastille Day Storm of 2000",other
@SnoogThe If Cleary was there they would have put 40 on the Storm… Unfortunately I don’t think the halves had enough fire power to trouble the storms compacted defensive line.,other
"Stay calm during your storms, it shows your growth.",other
"If you drive on the highway, windows full down during a thunderstorm you’re a fucking moron",storm
love it! https://t.co/DR09IsLjqt,other
"Monsoon Flash Flooding intercept yesterday north of the border in the dry Santa Cruz river bed Southeast of Nogales, Arizona!,1

Live Storm Chasers -&gt; Jaden Pappenheim | @PappenheimWx,1
#AZwx #Arizona #Monsoon2022 #Monsoon #Storms https://t.co/h4c9crlPNQ",storm
"Big thunderstorm coming in, time to get under a blanket and do some reading",storm
"@hulsopp3 Isn’t the sky wild tonight? It looked for awhile like we’d get a thunderstorm, but then it cleared.",storm
"This month's thunderstorm fatalities in Jigawa are as follows:,1
- A 12-year-old girl was killed by lightning -Aug 16,1
- 50 people killed, many displaced by flooding -Aug 14,1
- Rainstorm killed 7 people &amp; injured 65 others -Aug 1,1
When thunder roars, go indoor!, 0
https://t.co/lniNcN9dlq https://t.co/EZs31zWwgv",other
"It went from a restoration time of 9:30 to now 11:30. This makes me nervous cause the times kept changing during the winter storm &amp; it took 4 days to come back on. I know this is just a thunderstorm, so it’s not the same. But still makes me nervous lol it’s been 3hrs now #ercot https://t.co/GLNW4MLmQh",storm
This thunderstorm is perfect rn,storm
I remember storms use to be so peaceful.🥺,storm
Some gusty winds and flooding possible with these storms. #NBCDFWWeather https://t.co/C3eCsqbc4v,storm
Severe Thunderstorm Warning for the following counties/areas Maricopa until 17 Aug 6:45PM MST https://t.co/MwWte1bfHH,storm
"After Thursday's likely rain &amp; storms...more is in the works over the next 10 days! ,1

An influx of tropical moisture &amp; an unusual August pattern will kick up the daily shot at sorely needed wet weather. Side bonus: low/mid 90s on deck next week #bcstx https://t.co/gowltBXeIa",storm
"@TamaraVineberg @Jason_E_Woods Yes, a lot of areas just outside the city are on what used to be sand hills. It's probably why we don't see a lot of prairie dust storms anymore as it has grown over., 0

https://t.co/1yUlBxnKwx",other
Look at this lightning show from the storms over Dallas County! Wouldn’t mind if they shared the rain with us here in Frisco… #txwx https://t.co/26PDkHqeSG,storm
"Second incubus show in my life, second time it’s been delayed for hella insane storms. Thanks for the rain @IncubusBand!",storm
No cool storms can penetrate our disgusting cities,other
"SPOOKY BUCKET LIST #978: , 0
Watch THE TEXAS CHAINSAW MASSACRE outside on a humid summer night., 0

(a day early, but a girl’s gotta beat a thunderstorm) https://t.co/HOzXWIaZVI",storm
Why does my barn not have power thunderstorm EXPLAIN,other
hearing a thunderstorm for the first time in months sounds so magical,storm
Send the kids with the umbrellas and the rain jackets tomorrow - Storms are likely during the PM hours. Some storms may produce heavy rain/localized flooding and gusty winds #lawx #batonrouge https://t.co/l46AqjR7Ec,storm
"Thursday: Rain &amp; storms!,1

Temperatures race to the mid/upper 90s by midday / early afternoon. Scattered rain &amp; storms are expected to unzip between lunch &amp; early afternoon.,1

Isolated strong storms pushing gusty wind, (needed) locally heavy rain, frequent lightning #bcstx https://t.co/UMJKYVxRSV",storm
"L-let’s just get out of here faster I hate storms and it’s pretty late as well I’m getting a little sleepy myself heh…,1

[Vortex nudged Aevia back up on his back as he saw she was slipping],0

Th-Thanks bud I can always count on you,0
[38 minutes later they got closer too Terajuma is",other
"@Autumns_Storms @Shadumura @MabesLeonisoul @KorpsPropaganda we are the fourth and fifth, you just cant see them because we are on another plane of dumbassery",other
"The Met Office has a yellow thunderstorm warning in place across parts of Kent and Medway, in south east England, on Thursday morning,1

https://t.co/plpHFGMdKf",other
A little excitement in the 9th as a kid storms the field! #MedillSports https://t.co/0uJAsXY1OF,other
"Drove all over western South Dakota this afternoon chasing gusty storms that had just a few CGs, but was treated to a nice #lightning flash after I got home. #sdwx @NWSRapidCity https://t.co/BzSIh8ZQ1w",storm
"Thunderstorm Advisory No.01 #SL_PRSD,1
Issued at 11:00 AM, 18 August 2022,1

Moderate to a times heavy rainshowers with lightning and strong winds will be expected over #Romblon, #Masbate (Ticao island, San Francisco, Mulanay, San Andres), https://t.co/bReIm0eEAD",storm
"Full moon with a thunderstorm to back door, for sure things are shifting.",storm
the thunderstorm tonight was something else https://t.co/BOdyvjJeEb,storm
"Thunderstorm Advisory No. 4 #VIS_PRSD - Bohol Radar,1 
Issued at 10:56 AM, Thursday, 18 August, 2022,1 

Moderate to heavy rainshowers with lightning and strong winds due to thunderstorms are expected over #Bohol(San Miguel, Trinidad) and nearby areas within  1 to 2 hours. https://t.co/MC7TaiCskz",storm
"NWS Alert&gt; Severe Thunderstorm 11 Miles NE of Yuma Proving Ground or 21 Miles NE of Martinez Lake Moving SE At 15 MPH. 60 MPH Wind Gusts. Expect Damage to Roofs, Siding, &amp; Trees. This Severe Thunderstorm will Remain Over... #azwx https://t.co/bdDiZswzIT",storm
@AlanSevere Way too soon to say that. We could still see a couple of named storms from the two tropical waves coming off Africa. Both still have decent support on the ensembles,storm
"@jedi_storms @BatmanFiles No, well, I have no idea. But probably not.,1 
I was just immaturely making fun of his name.",other
Happy to be inside watching movies while it storms outside. Thankful for some rain and cooler temps too. ☔️ #Wednesday #txwx https://t.co/paEBvrlozq,storm
"A Severe Thunderstorm Warning is in effect until 8/17 10:30PM CDT.  If you are in the path of the storm, seek shelter and go to the lowest floor.  Stay away from windows and doors. #BEKNews #BEKWeather #NDWX #Warning https://t.co/YzKgnLT4AH",storm
bruh I like rain but storms are something different and I’m at work 😭😭,other
@Shadumura @MabesLeonisoul @KorpsPropaganda Then what in the stars' names are Syl and I supposed to do?,other
"Severe Thunderstorm Warning continues for La Paz County, AZ, Yuma County, AZ until 8:30 PM MST https://t.co/kIyKjgj1vI",storm
"Severe Thunderstorm Warning continues for La Paz County, AZ, Yuma County, AZ until 8:30 PM MST https://t.co/fTwwSLinWi",storm
"PSR continues Severe Thunderstorm Warning [wind: 60 MPH (RADAR INDICATED), hail: &lt;.75 IN (RADAR INDICATED)] for La Paz, Yuma [AZ] till 8:30 PM MST https://t.co/0Fpl1Gy8Pm https://t.co/2OYhgDXLcg",storm
"PSR continues Severe Thunderstorm Warning [wind: 60 MPH (RADAR INDICATED), hail: &lt;.75 IN (RADAR INDICATED)] for La Paz, Yuma [AZ] till 8:30 PM MST https://t.co/xrMvDaiTfq https://t.co/DX97xg9DLH",storm
"PSR continues Severe Thunderstorm Warning [wind: 60 MPH (RADAR INDICATED), hail: &lt;.75 IN (RADAR INDICATED)] for La Paz, Yuma [AZ] till 8:30 PM MST https://t.co/9mSdhiExHN https://t.co/N6CGytjtj8",storm
"PSR continues Severe Thunderstorm Warning [wind: 60 MPH (RADAR INDICATED), hail: &lt;.75 IN (RADAR INDICATED)] for La Paz, Yuma [AZ] till 8:30 PM MST https://t.co/XWXUNxgXzE https://t.co/ehKMKq9CUD",storm
"PSR continues Severe Thunderstorm Warning [wind: 60 MPH (RADAR INDICATED), hail: &lt;.75 IN (RADAR INDICATED)] for La Paz, Yuma [AZ] till 8:30 PM MST https://t.co/kywvPxFoyX https://t.co/zvhJRz2JMp",storm
"@StormhunterTWN @weathernetwork Very strange, the last month all these storms and rain have completely missed Halton Hills....it's as if we have a rain shield around us.  We need it, make it happen Mark!",storm
Severe Thunderstorm Warning for the following counties/areas Maricopa until 17 Aug 5:30PM MST https://t.co/6GF8vuYmVN,storm
WHERE ARE THE STORMS?,storm
There's a rainbow in the thunderstorm. https://t.co/PjnDwHu6qF,other
"@MartinW93129709 @mikdona @latimeralder You do realize that 5 degrees warmer doesn’t just mean people have warmer temps right? Lots of land will be under water, storms of all kinds will be more common and more devastating.",storm
This thunderstorm is hittin’ right now,storm
We almost starved to death!!! Human was at a work retreat all day and she had to stay even longer than planned because of a huge thunderstorm! Dinner is so so so late! https://t.co/grgpdCFofI,storm
"@Syntaxtakes Can't lie, ROSE would be a most welcome assistance in my practice.,0

I mean...the exposure therapy applications alone would be...beyond valuable. Let alone having an ally in the therapeutic alliance who has no agenda beyond seeing people grow and thrive.",other
"Temperatures in the middle 80s for highs in Lincoln Thursday. Could see some storms late afternoon in to the evening hours, too. https://t.co/BR36SlhUK6",storm
POV ur outside playing Pokémon Go when a thunderstorm pulls up https://t.co/wpBReGCR5I,storm
"The aurora borealis could appear in New York, Chicago, and Portland on Wednesday, as solar storms crash into Earth https://t.co/Da7cTQFTiJ",other
"#Lightning | If on foot: do's and don'ts to #StaySafe from #thunderstorm &amp; lightning 🌩,1 

➡ Don't take shelter under trees. https://t.co/iCtYYeZUeN",storm
This thunderstorm turning more into a lightning storm https://t.co/2D8LtKwqNE,storm
The lake sampling was right on time! First thunderstorm since June 3-4. https://t.co/kd5FXyhVAK,storm
"I missed the storms on the East side earlier that migrated towards downtown, and then left a meeting in Maple Grove at about 8pm and just missed this one too 😂😂 https://t.co/1zaitPLNtv",storm
storms in the summer &gt;&gt;&gt;,storm
"I’ll go through so my children won’t have to,whatever storms I whether they won’t.",storm
Thunder Rosa and Toni Storm of Thunderstorm!!!,storm
Thunderstorm!!!,storm
Shut up thunderstorm &gt;:c https://t.co/ph15RQzz1W,other
"Solar Storms Imminent, Disaster Cycle Confirmations | S0 News Aug.17.2022  https://t.co/H5mNlKSiWh https://t.co/y5W6C8lvEK",other
North Texas meteorologist had massive storms forecasted for me starting at 6pm and as of 10 not even a fkn drop of rain.  🙄 imagine getting paid to be wrong.,storm
"NWS Alert&gt; Severe Thunderstorm 5 Miles N of Napoleon Moving E At 30 MPH. 60 MPH Wind Gusts, Penny Size Hail. Expect Damage to Roofs, Siding, &amp; Trees. This Severe Thunderstorm will Remain Over Mainly Rural Areas of SE Kidd... #ndwx https://t.co/DcIwFSksm9",storm
"Severe Thunderstorm Warning continues for Napoleon ND, Streeter ND and  Kintyre ND until 10:30 PM CDT https://t.co/wOlbsKaE4o",storm
"Severe Thunderstorm Warning continues for Napoleon ND, Streeter ND and  Kintyre ND until 10:30 PM CDT https://t.co/JFaSXcrMp2",storm
More storms are on the way on Thursday morning... https://t.co/5CPceBHNE0,storm
"A tropical and at times a stormy sky over the Kanawha Valley and Charleston, West Virginia Wednesday evening. 📸 Michael Drumheller #WVwx #thunderstorm https://t.co/lGTR6kkSTG",storm
"#mbstorm 10:01p SEVERE THUNDERSTORM WARNING ENDED by Environment Canada,1 

The thunderstorm that prompted the warning has weakened to below severe limits.,1 

end/paspc,0

Moose Creek Prov. Forest Pine Dock And Matheson Island, 0
Peguis Res. And Fisher River Res., 0

https://t.co/H3fJBgkCS6",other
"BIS continues Severe Thunderstorm Warning [wind: 60 MPH (RADAR INDICATED), hail: 0.75 IN (RADAR INDICATED)] for Emmons, Kidder, Logan, Stutsman [ND] till 10:30 PM CDT https://t.co/GFKXuvNkv1 https://t.co/KU29YS34U3",storm
"BIS continues Severe Thunderstorm Warning [wind: 60 MPH (RADAR INDICATED), hail: 0.75 IN (RADAR INDICATED)] for Emmons, Kidder, Logan, Stutsman [ND] till 10:30 PM CDT https://t.co/xTYDXGpSFy https://t.co/7ch3qd4ost",storm
"BIS continues Severe Thunderstorm Warning [wind: 60 MPH (RADAR INDICATED), hail: 0.75 IN (RADAR INDICATED)] for Emmons, Kidder, Logan, Stutsman [ND] till 10:30 PM CDT https://t.co/CNGG2jcE2U https://t.co/zC6rxyzNj5",storm
"BIS continues Severe Thunderstorm Warning [wind: 60 MPH (RADAR INDICATED), hail: 0.75 IN (RADAR INDICATED)] for Emmons, Kidder, Logan, Stutsman [ND] till 10:30 PM CDT https://t.co/2uq2pknMp1 https://t.co/pqHFWbL4L2",storm
"BIS continues Severe Thunderstorm Warning [wind: 60 MPH (RADAR INDICATED), hail: 0.75 IN (RADAR INDICATED)] for Emmons, Kidder, Logan, Stutsman [ND] till 10:30 PM CDT https://t.co/dJbXwoxrFn https://t.co/FiUoGWAfrg",storm
THUNDERSTORM,storm
"GREAT News-Rain for many areas....,1 
Heaviest in the Capital Region...with that one severe storms moving through the Capital Region 5-6pm....few spots had wind damage and small hail,1 
Many spots picked up 1-2"" of rainfall.  ,1 
10pm 1st Weather.....,0

https://t.co/HAvIySXwOD",other
Today was nuts 🤪. Thunderstorm knocked out the lights 😴. Didn't come back on till later 🙃. Lucky for us. It was the middle of the day. So we still had light in the 🏠. Thank goodness that is over with. 😳,storm
@xzy_rain maybe something to do with rainstorms/storms or maybe something with clouds?,storm
"""Watch: Thunderstorm, flash floods hit Oulu "" - https://t.co/81ir7GWzso https://t.co/vRi1YBZ3GF",storm
"@CrytzerFry I watch it @ different times throughout the day up here. Storms start building over the peaks, coming up the mogollon rim,then roll off to bless someone (sometimes TOO much) w rain..thank you for this! https://t.co/pkUATBstfV",storm
A flood warning was issued for Johnson County and severe thunderstorm warnings have been issued for cities and and near Tarrant County.  https://t.co/kPhnruZUpE,storm
"@stevanzetti Great shot. (&amp; You’re like 4 streets over from my house &amp; it’s NOT raining here yet, Tx storms are so weird.)",storm
"Earth is at risk of ""radiation storms"" and ""cannibal"" Sun eruptions due to solar storms. Major interruptions might befall the aircraft as a ""cannibal"" solar flare hurtles toward the US. #NatureNews https://t.co/TVMrYirXlr",storm
