text,category
@honeysanniee ahh no ik i meant like this whole week has been so dry and hot and this thunderstorm came out of nowhere 🧍🏻‍♀️,storm
"Northern Lights possible between 9 and 12 tonight, otherwise remaining quiet other than a few showers across our southern valleys tomorrow. @RipCityWeather tracks isolated storms potentially developing late Friday, that threat heightens on Monday. https://t.co/SqAWmrBe3c",storm
This storm is either the scariest I’ve experienced or I forgot what a thunderstorm was like ⛈ 🌩,storm
"@AskFrontier hi this outage has been ongoing since 2pm eastern time. Unacceptable, no storms or rain currently. I do not understand why there is not an ETA by now.",storm
@Raidenrok_Music That is why I have so much trouble dealing with “church folk” or just people who are oblivious to life. I mean even JESUS CHRIST himself said that there would be storms in our lives. It’s what we do DURING those storms and how we help others out of their storm that separates us.,other
NWS Alert&gt; Strong Thunderstorm Near Tylerton or 12 Miles NE of Fair Port Moving S At 15 MPH. Winds Over 30 MPH. Gusty Winds Could Knock Down Tree Limbs &amp; Blow Around Unsecured Objects. Locations Impacted Include Tangier... #mdwx https://t.co/ki9siLzft3,storm
"Most of Friday is dry, but I'm tracking a cold front that will bring storm chances late Friday night and again on Saturday. A few storms on Saturday could be strong, but we'll clear out on Sunday with some dry time to enjoy these cooler temperatures. #midmowx https://t.co/NuNQMH9Oxf",storm
@JenniferBroome Hope you see something.  Looks like you'll have to compete with some towering storms over W. Nebraska!,storm
"A strong thunderstorm will impact portions of southwestern Somerset and northern Accomack Counties through 1145 PM EDT [wind: 30 MPH, hail: 0.00 IN] https://t.co/RSKjKiXPrx https://t.co/pDrfMdm5pj",storm
"A strong thunderstorm will impact portions of southwestern Somerset and northern Accomack Counties through 1145 PM EDT [wind: 30 MPH, hail: 0.00 IN] https://t.co/wADk53qT4i https://t.co/kaZ0En2aY2",storm
"A strong thunderstorm will impact portions of southwestern Somerset and northern Accomack Counties through 1145 PM EDT [wind: 30 MPH, hail: 0.00 IN] https://t.co/jbIPkDQAWB https://t.co/NQ1Pha0sbM",storm
@killgarrn And tacos. Tacos are an excellent recruitment tool.,other
Rainbow just before tonight’s lightning and thunderstorm which has been quite spectacular! https://t.co/GcYfVqRVWn,storm
"HOW is there a thunderstorm rn, it was literally so hot and sunny earlier today wth 😭 https://t.co/MSGsBPXu0T",storm
"#JUST IN: @oncor reporting nearly 12,000 customers without power as storms move across North Texas.  Ellis and Dallas Counties have the most outages at the moment.  @CBSDFW #FirstAlertDFW",storm
"NWS Alert&gt; Strong Thunderstorm Located 10 Miles E of Grassy Butte or 12 Miles W of Killdeer Moving SE At 35 MPH. Wind Gusts to 50 MPH &amp; 1/2"" Hail. Gusty Winds Could Knock Down Tree Limbs &amp; Blow Around Unsecured Objects.... #ndwx https://t.co/rqzYJ104yM",storm
"As of right now, our front is still up north but producing storms in the vicinity making their slow decent to the south. They may inch towards Waco here in the next hour or so, but remember, the sun has set so we lost a key source of energy for additional storms to develop. #txwx https://t.co/i7YX4AWRv9",storm
"When your original destination is shut down by storms, Oklahoma City is a safe refuge.  Now, let’s hope the crew don’t go over their hours and we get stuck here overnight! https://t.co/dY4PzOXHMp",storm
Loving these storms right now,storm
Multiple flights diverting to OKC due to storms in the DFW area. #okwx #txwx https://t.co/U6kIDAo0x8,storm
"9:53PM First Alert! Check out the storms moving toward downtown Dallas on our Dallas Sky Cam. A lot of lightning, heavy rain and gusty winds possible.  #FirstAlertDFW https://t.co/FjXBkxubc5",storm
"Severe Thunderstorm Warning continues for La Paz County, AZ, Yuma County, AZ until 8:30 PM MST https://t.co/CuMM78rp3n",storm
"@thehill Let me rephrase. The GOP acts WORSE than Democrats and BLM combined. They burn police station, GOP storms the place with guns.",other
"Severe Thunderstorm Warning continues for La Paz County, AZ, Yuma County, AZ until 8:30 PM MST https://t.co/7JAymh0j5M",storm
Now playing Thunderstorm - Hey You Get Ready (Red Light's On) [1979] on https://t.co/Q2Rw49adml #disco #soul #funk #vinyl #studio54,other
"PSR continues Severe Thunderstorm Warning [wind: 60 MPH (RADAR INDICATED), hail: &lt;.75 IN (RADAR INDICATED)] for La Paz, Yuma [AZ] till 8:30 PM MST https://t.co/lVCqsGez6u https://t.co/6rD1nk6wGY",storm
"PSR continues Severe Thunderstorm Warning [wind: 60 MPH (RADAR INDICATED), hail: &lt;.75 IN (RADAR INDICATED)] for La Paz, Yuma [AZ] till 8:30 PM MST https://t.co/LiJ1ZArsG0 https://t.co/khIjoe0jpZ",storm
"PSR continues Severe Thunderstorm Warning [wind: 60 MPH (RADAR INDICATED), hail: &lt;.75 IN (RADAR INDICATED)] for La Paz, Yuma [AZ] till 8:30 PM MST https://t.co/AZSyLR9EOQ https://t.co/qZJF1qQUUj",storm
"PSR continues Severe Thunderstorm Warning [wind: 60 MPH (RADAR INDICATED), hail: &lt;.75 IN (RADAR INDICATED)] for La Paz, Yuma [AZ] till 8:30 PM MST https://t.co/0tgeyqSVKS https://t.co/UQW0pFWqUc",storm
"PSR continues Severe Thunderstorm Warning [wind: 60 MPH (RADAR INDICATED), hail: &lt;.75 IN (RADAR INDICATED)] for La Paz, Yuma [AZ] till 8:30 PM MST https://t.co/FNowMiRwkX https://t.co/Grs2xoLXs3",storm
"A STRONG THUNDERSTORM WILL IMPACT PORTIONS OF SOUTHWESTERN DUNN, NORTHEASTERN BILLINGS AND SOUTHEASTERN MCKENZIE COUNTIES THROUGH 930 PM MDT [wind: 50 MPH, hail: 0.50 IN] https://t.co/4EZQL3CgP0 https://t.co/9RLr4HjtKC",storm
Through the storms and the light,other
"Thunderstorm Advisory No. 2 #VIS_PRSD -Mactan Radar,1 
Issued at 10:51 AM, Thursday, 18 August, 2022,1 

Moderate to heavy rainshowers with lightning and strong winds due to thunderstorms are expected over #Leyte(Kananga) and nearby areas within 30 minutes to an hour. https://t.co/uqsECmitN1",storm
@kristenmchugh22 We had a freak(very short) thunderstorm here,storm
"Arlington Tx - cold front moving through ,severe thunderstorm. @startelegram @ArlingtonTxFire @NWSWPC @NWSFortWorth @NBCDFW https://t.co/9iG534RtRc",storm
"IRSnews: Individuals and businesses affected by the severe storms, tornadoes, and flooding that began on May 2, 2022, in parts of Oklahoma may qualify for #IRS tax relief. https://t.co/DLf7BWncUf https://t.co/PYaMdgC9NC",storm
"🟡 ⛈️ Thunderstorm , Current Temp: 83° // Chance of precipitation 83%. Breezy, with wind speeds of 18 MPH. // Traffic destined *TO DFW* Airport is currently being delayed at its departure point 🤿 | 09:55 PM |",storm
"@JJFarrell451 @60sPsychJukebox @Rhino_Records Hitchhiked every day for recreation &amp; employment.Worked plenty of jobs where my thumb got me to &amp; from work.Always made it on time,all different hrs ,mornings/ late nights, all conditions ,beautiful summery days to snow storms with frigid temps.Hitchhiking ended around mid 70s.",storm
listening to carti’s live set driving through a thunderstorm &gt;&gt;,other
Crazy storms here in TX but thankfully we have Tesla power walls since our power just went out. https://t.co/tDhl6L2UcO,storm
@OTN_Weather Ever since it's upgrade after Sandy in 2012 it has not been the same. GFS has been better sniffing out LR STORMS.,storm
The sound/ smell of monsoon storms &gt;&gt;&gt;,storm
"@lakshgiri Now that I’ve finished the season, I’m curious about your thoughts! I liked this season best so far, but maybe because it’s nice to finally see the characters evolving a bit.",other
"R3| Figgy lands a big hook off the bat, Askarov gets a nice blast double but Figgy is up and out. Askarov starts throwing some strikes as he gets blasted with a BIG right hand AND HE'S DOWN! Figgy storms over as Askarov struggles to get up but time expires. https://t.co/rCHknFdKCn",other
@OfficialGNIDA @CPCB_OFFICIAL @NGTribunal @dmgbnagar @CMOfficeUP @myogiadityanath @myogioffice @iassurendra Thank you all for looking into this serious issue so diligently. Construction material is now scattered all over the road and vehicles passing by are creating dust storms forcing people to wear masks. Much appreciated efforts 🙏 https://t.co/JJCEtlwFDU,other
Thunderstorm in La Paz will continue until 8:30 pm tonight. https://t.co/SJ4r6VRTDC,storm
"9:50pm - There are NO severe storms in North Texas right now. But any storms have very heavy rain and lots of lightning. Some strong wind gusts possible as well. Storms are very slowly trying to drift north thru Tarrant and Dallas counties.,1 

Radars: https://t.co/ji6YaxLBma https://t.co/PNwiIuX9nv",storm
@killgarrn @Shadumura Our viktory...is ASSURED!,other
"9:50pm - There are NO severe storms in North Texas right now. But any storms have very heavy rain and lots of lightning. Some strong wind gusts possible as well. Storms are very slowly trying to drift north thru Tarrant and Dallas counties.,1 

Radars: https://t.co/PyKreFAs8D https://t.co/AY0D5YTzYH",storm
"Fall asleep with thunderstorm and Rain sound so very powerful, stay asle... https://t.co/r4zr218xj4 via @YouTube",other
"@blklilacc THIS HURTS ME SO MUCH😭now what would kndk do abt this, i wonder how she'll react when dhy storms out and promises she'll finally never reach out to kndk bc after all this is all she wanted right? ""you wanted us to stay friends? ill give you better, ill tell them i dont know you""",other
The calm before the storms: Why 2022's hurricane season won't stay quiet much longer https://t.co/Fi3R1o6yev,storm
Severe Thunderstorm Warning for the following counties/areas Palo Pinto until 17 Aug 9:30PM CDT https://t.co/h9I9VLthgL,storm
"@MelanieHoo @KatelynBotsford Seriously, this is bordering on abuse, Katelyn. You’ve abandoned us.",other
"@TullimonstrumC @benmooreau @njbtweet @insane_voice @ALefty123 @Lo_VVriter @KathyGrants @Spencerfletch0 @kniggliator @aSinister @peblackstock @Stephen90045069 @WesHamel @Wallisbadgerson @WeRone777 @DocSnow1 @JJJungleJim @ozzorro1 @JackJsherebkin @Ceist8 @glinch72 @FriendsOScience @mac_an_ghoill @realJohnJHoward @USNA_73 @BernaB_2013 @markinkorea @talipes @Andrewemcameron @ZombiePiano @StuartRenshaw6 @cbeckj @Frankd06830 @LesterDent @toddynd @OzzmanOsgood @AlexVickeryHowe @Alfred_StatesX @goingglocal @BarnhartDooie @RstrixxX @Veritatem2021 @berry_hardman @FLastrade @SageThinker99 @ronkonoma @choosefreedomf1 @verycentrist @IceAge2150 @ejwwest It must be nice being so ignorant.,0

Humans got better a building more durable buildings.,0

That doesn’t mean storms got more calm.,0

But what did I expect from someone measuring climate change based on GDP and damage to buildings.0

Im sorry the education system failed you",other
TWC expires Severe Thunderstorm Warning for Pima [AZ] https://t.co/6UYdVI4ojO https://t.co/glGYdMBrIW,storm
TWC expires Severe Thunderstorm Warning for Pima [AZ] https://t.co/sHgxmAXsd0 https://t.co/BSTnM32ohI,storm
TWC expires Severe Thunderstorm Warning for Pima [AZ] https://t.co/fnH0qUyKrl https://t.co/oeIJALNaaW,storm
TWC expires Severe Thunderstorm Warning for Pima [AZ] https://t.co/REEn4TQmdk https://t.co/kTcTOWWchU,storm
arguing outside in a thunderstorm?? pls get a hold of yourself,storm
"Despite the storms and heavy challenges and battles it has faced on its own, the light and spark of hope from within continues to spread.  In the middle of this fight, keep hoping, waiting, persevering for luck in the fight of this life.",other
"Between pummeling winter storms when the thick gray clouds eventually clear, the majesty of this area is finally revealed. Often times, you're left waiting weeks for good weather.",other
i would give anything to be able to exist in the clouds during a thunderstorm,other
"The strong storms this evening over parts of NWFL have finally fizzled. It should remain quiet tonight while you sleep, but expect a good chance of another round of storms Thursday early to mid-morning moving west to east. #NWFL #FLWX https://t.co/MfqqqRYZ40",storm
@karelly_soleil A storms brewin!,other
"Crazy rainfoot earlier today with storms that blew up on the mountains West of St. George! I had guitar lessons so I couldn't attempt for lightning captures, but I did snag this photo at least #utwx #wxtwitter https://t.co/5UowT8uD6R",storm
"i went swimming for a little bit. it started raining really hard, so we had to come inside. either way, lots of water.,1  

omg this thunderstorm is crazy with lightning and thunder!!",storm
"Back in the ""green"" w/some heavy storms possible: SPC has Acadiana in a ""marginal"" risk (level 1/5) for an isolated severe storm capable of damaging winds while WPC has us hatched in for a ""marginal"" risk (level 1/4) for excessive rain/localized street flooding possible. #LAwx https://t.co/ngjzKE5nqi",storm
@LRyan_Storms @KatelynBotsford We need to know,other
"@Autumns_Storms @Shadumura Hwee captured eet, for kay-oss!",storm
If you have five 100 year storms in one year at what point do you start realising the odds have changed substantially?,storm
@Kiss_My_Mask I love a good thunderstorm.,storm
WeatherBug is acting like this thunderstorm will annihilate my house off the damn map. https://t.co/tDpP284j3U,storm
Went to class today. Left class to huge thunderstorm. 25mph winds was completely drenched. My hat and sunglasses fell into a puddle. A tree branch fell on my truck. (Truck is fine) my notebook I just bought is now ruined. https://t.co/8SbrVoFBEA,storm
❤️ Never thought a thunderstorm would make me so happy! ⛈️,storm
Looking south towards DFW storms this evening from Sherwood Shores on Lake Texoma. Photo from Jerry Green. #txwx https://t.co/8cdbE5SbhP,storm
"im sittin on my balcony, drankin, and enjoyin the thunderstorm",other
Woken up by a thunderstorm and now can't sleep,storm
It’s a thunderstorm ⛈ and lightning ⚡️ …. Ion like shit like this …,storm
What’s up with these random ass Texas storms,storm
Sunset after Storms rolled thru https://t.co/Uv2fYZXx0F,storm
an impressive day watching storms on the outskirts of the Coachella Valley https://t.co/HAUvqpYrz6,storm
"Thunderstorm Advisory No. 3 #VIS_PRSD - Bohol Radar,1 
Issued at 10:39 AM, Thursday, 18 August, 2022,1 

Moderate to heavy rainshowers with lightning and strong winds due to thunderstorms are expected over #Bohol(Pilar, Dagohoy) and nearby areas within  1 to 2 hours. https://t.co/8HGvAOGmlN",storm
I just want a crispy burger &amp; a thunderstorm.,storm
i hope it storms all night cuz imma sleep so good 😭🤧,storm
Usually he doesn't care about storms but tonight he is nervous ig https://t.co/PuUM62aIci,storm
This and a thunderstorm hits so good https://t.co/ucmcFAvrP1,storm
"A strong thunderstorm will impact portions of southwestern Box Butte, southwestern Dawes and southeastern Sioux Counties through 930 PM MDT [wind: 40 MPH, hail: 0.50 IN] for Box Butte, Dawes, North Sioux, South Sioux [NE] https://t.co/TuxkSuRRF2 https://t.co/JbSummGuWr",storm
"A strong thunderstorm will impact portions of southwestern Box Butte, southwestern Dawes and southeastern Sioux Counties through 930 PM MDT [wind: 40 MPH, hail: 0.50 IN] for Box Butte, Dawes, North Sioux, South Sioux [NE] https://t.co/0hxDImWjLh https://t.co/iqCE1FwjMB",storm
@texas yo wtf this thunderstorm doin ???????,storm
North Dakota lightning storms are something else man https://t.co/WkSucCi2S9,storm
"GM! So much calm before the storms! No one really knows where we are heading on the macro environment.,0

Thought of the day:,0

Credibility &amp; trust been corroded so much over time, we have no idea what sources to trust. Everyone has their agenda &amp; it's highly likely to con you. 😏",other
"August 17, 2019 crazy clouds on a work Sunday, Storms a brewin' @LHSCCanada https://t.co/EUOdX2LiRL",other
Severe Thunderstorm Warning for the following counties/areas Maricopa until 17 Aug 5:30PM MST https://t.co/yCr0Rkfm9G,storm
"Walking home from the movie theater after watching Nope. There's a thunderstorm in Minneapolis right now, so the sky's full of lightning, like a million camera flashes going off at once. Very apropos",storm
"Your old clock holds pain; ,0
this seagull seasons of storms.",other
"NWS Alert&gt; Severe Thunderstorm 15 Miles N of Yuma Proving Ground or 24 Miles N of Martinez Lake Moving SE At 10 MPH. 60 MPH Wind Gusts. Expect Damage to Roofs, Siding, &amp; Trees. This Severe Thunderstorm will Remain Over... #azwx https://t.co/RGAc902Oia",storm
Severe thunderstorm lol,storm
"@wanda_Robbins67 Stressful driving, like in a heavy rainstorm.",other
A Severe Thunderstorm Warning has been issued until 8/17 8:30PM MST. View our maps here: https://t.co/sWkgEOozzj #hail #wind https://t.co/8zgztt6A35,storm
Smoking outside during a thunderstorm is exactly what I needed today,storm
severe thunderstorm over here https://t.co/iSnL7syWfc,storm
"Severe Thunderstorm Warning including La Paz County, AZ, Yuma County, AZ until 8:30 PM MST https://t.co/Lzrci3ha3R",storm
"Severe Thunderstorm Warning including La Paz County, AZ, Yuma County, AZ until 8:30 PM MST https://t.co/TT2gYVbxaE",storm
Severe Thunderstorm Warning for La Paz and Yuma County in AZ until 8:30pm MST. #tacswx #AZWX,storm
"PSR issues Severe Thunderstorm Warning [wind: 60 MPH (RADAR INDICATED), hail: &lt;.75 IN (RADAR INDICATED)] for La Paz, Yuma [AZ] till 8:30 PM MST https://t.co/RcJxaJQsjb https://t.co/n6RRkS8NuF",storm
"PSR issues Severe Thunderstorm Warning [wind: 60 MPH (RADAR INDICATED), hail: &lt;.75 IN (RADAR INDICATED)] for La Paz, Yuma [AZ] till 8:30 PM MST https://t.co/pbrhbbNlyQ https://t.co/34xjbqedwq",storm
"PSR issues Severe Thunderstorm Warning [wind: 60 MPH (RADAR INDICATED), hail: &lt;.75 IN (RADAR INDICATED)] for La Paz, Yuma [AZ] till 8:30 PM MST https://t.co/FTMyQZBQeY https://t.co/A0iGcakwsX",storm
"PSR issues Severe Thunderstorm Warning [wind: 60 MPH (RADAR INDICATED), hail: &lt;.75 IN (RADAR INDICATED)] for La Paz, Yuma [AZ] till 8:30 PM MST https://t.co/uYxabKJPsZ https://t.co/q81RxZM82e",storm
"PSR issues Severe Thunderstorm Warning [wind: 60 MPH (RADAR INDICATED), hail: &lt;.75 IN (RADAR INDICATED)] for La Paz, Yuma [AZ] till 8:30 PM MST https://t.co/StPI98S2oO https://t.co/YF3yGKBbxw",storm
"PSR issues Severe Thunderstorm Warning [wind: 60 MPH (RADAR INDICATED), hail: &lt;.75 IN (RADAR INDICATED)] for La Paz, Yuma [AZ] till 8:30 PM MST https://t.co/I0mgDq3wwO https://t.co/gtCTtr3LQi",storm
"PSR issues Severe Thunderstorm Warning [wind: 60 MPH (RADAR INDICATED), hail: &lt;.75 IN (RADAR INDICATED)] for La Paz, Yuma [AZ] till 8:30 PM MST https://t.co/IgBPdPzsPd https://t.co/0vDZKGdAw1",storm
"PSR issues Severe Thunderstorm Warning [wind: 60 MPH (RADAR INDICATED), hail: &lt;.75 IN (RADAR INDICATED)] for La Paz, Yuma [AZ] till 8:30 PM MST https://t.co/cSGKuGyFfb https://t.co/ZOkZ70T1nR",storm
Severe Thunderstorm Warning for La Paz and Yuma County in AZ until 8:30pm MST. #azwx,storm
orion is such a cool name tho,other
Oh no. It's a severe thunderstorm. *grabs my kittens and cuddles* I hate them,other
"A Severe Thunderstorm Warning is in effect until 8/17 10:30PM CDT.  If you are in the path of the storm, seek shelter and go to the lowest floor.  Stay away from windows and doors. #BEKNews #BEKWeather #NDWX #Warning https://t.co/c4v0tAuUZy",storm
Storms are moving South-East. I'm not holding my breath for Greenville tonight. https://t.co/vS0rLMADwO,storm
Reading with this thunderstorm in the background is a vibeee,storm
Mother Nature screwed me once again! The storms missed us! Like literally all I want is thunder and the sound of rain so I can curl up and sleep!,storm
@nancyterhune @kilonova_gold @PollyCHaag @9pandora @cincity631 @EllenEnders @cmmorgann @SawyerSteve @HalMarshall2309 @Megawatts55 @RickPetree @HCandler @arenella1 @JennPinkowski Their anger is an electrical thunderstorm continuously circling the central nervous system. Something has to interrupt the circuit. The energy has nowhere to go at present.,storm
@storms_storms18 Ohhh Geezz 79 and 81! Lol,storm
@CStewMedia @accuweather And my cat is terrified. Animals and storms - a whole topic!🙀,storm
@1984Ragnarok It's been awhile since we've had a thunderstorm. They've been missing us.,storm
@StuEdwards12 @1kalwaysopen_ What snow storms and accumulation?,storm
A Severe Thunderstorm Warning has been issued. Severe Thunderstorms are capable of large hail and damaging wind. Seek shelter in an interior room. Tune to Valley News Live or visit our web site at https://t.co/GrmkGIjenB for the latest. #VNLFirstAlert https://t.co/FP5ZVzS2LE,storm
Can’t wait for them fall rain storms,storm
Viewer video captured some of the intense flooding that struck the east and north Twin Cities metro on Wednesday as rain storms stalled over areas.  https://t.co/V57PIWftFa,storm
"Lord have mercy, My excitement for the (severe) thunderstorm has ceased Lmao; Stream has ended due to power outage - Thank you for the raids @DandyDemonVT @TorstenEriksson ♥",storm
"It's Possible to Serve in Storms - All of us experience some storms where everything goes wrong. If we trust God, it's possible to grieve while in a storm and still serve. #ChangingFocus #storms #serve  https://t.co/Dzjcl3rdMM via @JenaRFellers",other
"FWD expires Severe Thunderstorm Warning for Dallas, Tarrant [TX] https://t.co/RgubEVbQSs https://t.co/RgSTxzr1pa",storm
"FWD expires Severe Thunderstorm Warning for Dallas, Tarrant [TX] https://t.co/JMFj0siS2o https://t.co/VoIJME9ZOq",storm
"FWD expires Severe Thunderstorm Warning for Dallas, Tarrant [TX] https://t.co/eAgucZaKWB https://t.co/VPNQCRvxCH",storm
"FWD expires Severe Thunderstorm Warning for Dallas, Tarrant [TX] https://t.co/ya4TFUZODj https://t.co/J1qsPYBJh9",storm
"FWD expires Severe Thunderstorm Warning for Dallas, Tarrant [TX] https://t.co/5co2bKpd0F https://t.co/QZKg6syaJg",storm
"FWD expires Severe Thunderstorm Warning for Dallas, Tarrant [TX] https://t.co/DrDefL0Gbq https://t.co/xlPd2PvkL8",storm
"FWD expires Severe Thunderstorm Warning for Dallas, Tarrant [TX] https://t.co/RAibWanzar https://t.co/nuwbl96Bz4",storm
"FWD expires Severe Thunderstorm Warning for Dallas, Tarrant [TX] https://t.co/o9uGx07pBN https://t.co/VvSRihqZLF",storm
"FWD expires Severe Thunderstorm Warning for Dallas, Tarrant [TX] https://t.co/jFp8awct3Z https://t.co/aNNpvNv9ZV",storm
"FWD expires Severe Thunderstorm Warning for Dallas, Tarrant [TX] https://t.co/l6stC435ln https://t.co/2h3bxKGfcP",storm
"FWD expires Severe Thunderstorm Warning for Dallas, Tarrant [TX] https://t.co/sXg3eaqkVf https://t.co/M1GP1T6Ci6",storm
"FWD expires Severe Thunderstorm Warning for Dallas, Tarrant [TX] https://t.co/DalRWB0sKH https://t.co/KSOSAxHwju",storm
"FWD expires Severe Thunderstorm Warning for Dallas, Tarrant [TX] https://t.co/0T2OhkuUEF https://t.co/JllzC0lqxA",storm
This thunderstorm was the worst thing that could happen rn…,storm
Several severe storms have also brought on flash flooding. Here's the latest at this hour.  #azwx #FirstAlertForecast https://t.co/t2TqlzEgtA,storm
A Severe Thunderstorm Warning has been issued until 8/17 10:30PM CDT. View our maps here: https://t.co/sWkgEOozzj #hail #wind https://t.co/AchRd1QN8t,storm
"Severe Thunderstorm Warning including Napoleon ND, Streeter ND and  Kintyre ND until 10:30 PM CDT https://t.co/bhOIsTS1Nv",storm
"Severe Thunderstorm Warning including Napoleon ND, Streeter ND and  Kintyre ND until 10:30 PM CDT https://t.co/cVjgrcTCr2",storm
This is a good ass thunderstorm. I wish I had someone to cuddle with 😩😩,storm
"Severe Thunderstorm Warning for Emmons, Kidder, Logan and Stutsman County in ND until 10:30pm CDT. #tacswx #NDWX",storm
"Severe Thunderstorm Warning for Emmons, Kidder, Logan and Stutsman County in ND until 10:30pm CDT. #ndwx",storm
"BIS issues Severe Thunderstorm Warning [wind: 60 MPH (RADAR INDICATED), hail: 1.00 IN (RADAR INDICATED)] for Emmons, Kidder, Logan, Stutsman [ND] till 10:30 PM CDT https://t.co/WlJVzjSfm4 https://t.co/4yShdBtKbq",storm
"BIS issues Severe Thunderstorm Warning [wind: 60 MPH (RADAR INDICATED), hail: 1.00 IN (RADAR INDICATED)] for Emmons, Kidder, Logan, Stutsman [ND] till 10:30 PM CDT https://t.co/Ve458k5JQk https://t.co/YzKeGhHTlH",storm
"BIS issues Severe Thunderstorm Warning [wind: 60 MPH (RADAR INDICATED), hail: 1.00 IN (RADAR INDICATED)] for Emmons, Kidder, Logan, Stutsman [ND] till 10:30 PM CDT https://t.co/KVl1UObEye https://t.co/J5YUz7EwAh",storm
"BIS issues Severe Thunderstorm Warning [wind: 60 MPH (RADAR INDICATED), hail: 1.00 IN (RADAR INDICATED)] for Emmons, Kidder, Logan, Stutsman [ND] till 10:30 PM CDT https://t.co/T3VRhPhULS https://t.co/Z6VGGn9gx4",storm
"BIS issues Severe Thunderstorm Warning [wind: 60 MPH (RADAR INDICATED), hail: 1.00 IN (RADAR INDICATED)] for Emmons, Kidder, Logan, Stutsman [ND] till 10:30 PM CDT https://t.co/pvPOvRG8Fk https://t.co/lioaIYwlBK",storm
"BIS issues Severe Thunderstorm Warning [wind: 60 MPH (RADAR INDICATED), hail: 1.00 IN (RADAR INDICATED)] for Emmons, Kidder, Logan, Stutsman [ND] till 10:30 PM CDT https://t.co/VvTyStJuJo https://t.co/rbh0zvhAW9",storm
"BIS issues Severe Thunderstorm Warning [wind: 60 MPH (RADAR INDICATED), hail: 1.00 IN (RADAR INDICATED)] for Emmons, Kidder, Logan, Stutsman [ND] till 10:30 PM CDT https://t.co/UFM3t2FczP https://t.co/FJhqkq5brr",storm
"BIS issues Severe Thunderstorm Warning [wind: 60 MPH (RADAR INDICATED), hail: 1.00 IN (RADAR INDICATED)] for Emmons, Kidder, Logan, Stutsman [ND] till 10:30 PM CDT https://t.co/OTZHUiDilG https://t.co/5nxLxvS6kz",storm
"It's Possible to Serve in Storms - All of us experience some storms where everything goes wrong. If we trust God, it's possible to grieve while in a storm and still serve. #ChangingFocus #storms #serve  https://t.co/ICfZwGxZEh via @JenaRFellers",other
"Live Radar: Cold Front Brings Scattered Storms, Cooler Temperatures on the Way https://t.co/YPbtUOBspt",storm
