text,category
Soaked stations and submerged cars: storms flood parts of London https://t.co/qY2zzfepKY via @YouTube,storm
"@Matthew_Dooher @gunsnrosesgirl3 Yeah. the more I watched the more I realized, I'm gonna rethink about how cautious and truly aware of my surroundings I am during storms.",storm
Shit come wit storms they prolly didn’t tell you that part,other
"Thunderstorm Advisory No. 9 #NCR_PRSD, 1
Issued at: 12:50 PM,18 August 2022 https://t.co/A9K4M7fVAE",storm
Storms over the metroplex ⭐️ https://t.co/ggEH1mzZnE,storm
"@Amester222 I just drove through a thunderstorm in Dallas 😳, 1
We need the rain, but it was some of the scariest weather I’ve been through.",storm
#ClimateEmergency in the UK - Storms and flash floods hit southern England https://t.co/sVO2WdweJZ #EndFossilFuels @Join @ExtinctionR,storm
"Good Morning everyone! We had a small thunderstorm yesterday. Sadly the flashes decides to stay out of camera, the lightshow is still nice to see tho. But a timelapse prolly is not the best format for something like that. https://t.co/BEcLEomyTP",storm
"Efficient person at the right place can create a big change, 0

I rmmber when it was MQM, we use to travel like a litter unfortunately, 0

Jam sb is on roads since night,after heavy thunderstorm which is still raining under taken conditions Hyderabad is all clear, 1

 @BBhuttoZardari 💯",other
"@MrSquiggleAu @Jamesrus42 Thanks hun. Very precarious situation on the West of the South Island😢 I’m in Auckland, so just the usual winter storms here. Climate change is no joke though, huh?",storm
"Flood advisory issued for Tarrant, Dallas, other counties as severe storms hit area https://t.co/7et6XuzI6V",storm
Storms over Dallas and the metroplex ⭐️ https://t.co/mojYaDyb7H,storm
Why you riding your bicycle at this time??…. In a thunderstorm,storm
"The weather forecast says it’s a cloudy thunderstorm today. But it’s actually just full sun and hot AF, even the temperature is wrong. 😂👌🏻 https://t.co/52rkZVBVlh",storm
"@BOWorldwide @TwitterIndia Don't waste all your money just yet, it's a long way to Pathan's release. Then spend the money on fake twitter storms and trends.",other
this thunderstorm has my baby girl scared 🥺🤯,storm
@DelusRblx Omg I like them so much they look so fresh like it gave an aura after a rainstorm,storm
"@t4_trisha The gif finally ran, storms slowed the wifi.@😅",storm
"@MabesLeonisoul Well, closer to three years of active talking., 0

Before that...comments here and there., 0

Furtive glances from across the internet, etc., 0

Not counting our encounter in the long long ago.",other
"@Hosalikar_KS Sir, I request you and IMD team to please look into NDA AWS, above 60mm rain in the last 24hrs seems incorrect as no other stations in Pune city even recorded 5mm. Also, there was no thunderstorm also in the area in last 24hrs. Earlier also NDA AWS giving totally wierd readings.",storm
@kevindotmp3 your chaotic tweet storms are part of what makes you beautiful,other
2 of the kittens ans the young queen were in OUR garage because dipshit has their garage closed for some reason. a storms supposed to be moving through tonight so we put some food and water out there and are gonna leave the door cracked :/,storm
"Bring thunderstorm, love has a personality., 0
An empire there isn't ے⁦نون⁩- . The only loss    ك̷و̷د̶⁩ ⁦̸خ̷ص̸م̴⁩  .   is the best part https://t.co/KvGk8JFwxq",other
"@V1ral2 thanks, 0
just 1 away",other
"Life is full of blessings 😇 , jus gotta get through the storms 💪🏽",other
"@Eleven_Storms However y'do it, the prize will definitely be awesome. Congrats on 200, you deserve the attention for your work",other
Navigation of the lake is rendered difficult both by sudden storms and by the absence of good bays and ports.,storm
Solar burst from 'hole' in the sun may trigger geomagnetic storms on Earth https://t.co/ZuzS1yaQJn,storm
"MARINE TSTM WIND  Mag: M41 MPH , 1
From: WFO MFL, 1
Location: 2 ESE LAKE WORTH, FL, 1
Time: 0736 PM  LT on 08/17/2022, 1
Source: C-MAN STATION, 1
Remarks: The noaa c-man station lkwf1 at lake worth pier measured a 41 mph wind gust out of the nw with a thunderstorm moving offshore. , 1
#FLwx",storm
"At 7:36 PM EDT, 2 ESE Lake Worth [Amz650 Co, FL] C-MAN STATION reports MARINE TSTM WIND of M41 MPH. THE NOAA C-MAN STATION LKWF1 AT LAKE WORTH PIER MEASURED A 41 MPH WIND GUST OUT OF THE NW WITH A THUNDERSTORM MOVING OFFSHORE. https://t.co/OoaNPaRvBH",storm
I love the rain … I love when it storms …,storm
"do i raffle for 1 follower or set a higher goal, 0
i don't know how these work",other
It’s supposed to thunderstorm tonight so I guess I’ll be running down the street in my underwear again. This monsoon season is exhausting.,storm
Power went out tonight during a dry thunderstorm. Got a call from the power company saying it would be restored by 4:30 PM tomorrow. Ten minutes later it was back.,storm
"Experienced a true Texas trifecta tonight: thunderstorm, mosquito bite, and a giant cockroach in my bedroom",storm
"🚨Breaking!, 0
An armed Ron DeSantis STORMS US capital and ousts all Democrats! Biden flees to Mexico; Dash Dobrofsky to be inaugurated president tomorrow afternoon 4PM EST!, 0
- @APNews reports   🚨",other
@Autumns_Storms Has it really only been two years?,other
Striking Pictures of Storms around the World https://t.co/FnNp2QqkwY https://t.co/B2OhgymGNv https://t.co/JlsuQVy21i,storm
"@MabesLeonisoul Heeeey, that thread is actually where I worked up the courage to talk to you for the first time, no less!",other
SOLAR FLARE FRENZY!! / Incoming SOLAR STORMS / Atlantic Tropical STORMS https://t.co/B0NZahSzGN via @YouTube,storm
Great strategy meeting with all Solution Center Dir. at @planonsoftware in a tent in Wijchen during a thunderstorm - a memorable and fun experience 😀 https://t.co/pffwAHhoD0,storm
SCREAMING CRYING PERFECT STORMS,storm
Ruthless Raducanu storms into Cincinnati third round https://t.co/WW6LgkHH81,other
"@gregdemarco1964 Looks like Italy or Florida, 0 
Under massive electrical storms and ablaze",storm
Solar burst from 'hole' in the sun may trigger geomagnetic storms on Earth https://t.co/kzOFZPoUmZ,storm
"9:30p UPDATE:, 1 
ODF is currently working 7 fires in Jackson County and 20 in Josephine County., 0
https://t.co/1jTudnWI5Y",other
I love a good thunderstorm.,storm
"9:30PM WEATHER*NOW* RADAR: You see flashes of light to the north? You're seeing these storms in Lincoln Co w/ a few cells in north Clark. We'll be sure to let you know ASAP if these storms will impact the valley. Don't forget us on #8NN @ 11, 1
#MostACCURATE #TeddSaid #WeatherNow https://t.co/h0fiR9aDqb",storm
"Is, I only bring thunderstorm, They also moved as one is from the, 0
An empire there isn't ے⁦نون⁩- . The only loss    ك̷و̷د̶⁩ ⁦̸خ̷ص̸م̴⁩  .   is the best part https://t.co/xLYqRklhtM",other
UK weather: Storms and rain bring flash floods to southern England https://t.co/NgSkRJqM08,storm
Partly cloudy. 30 percent chance of showers early this evening with risk of a thunderstorm. Low 15. https://t.co/0E4HhkFRlw,storm
"We finally live in a world where Goku, Superman, Thor and Darth Vader are all in the same videogame together https://t.co/ELKdjrSA8e",other
"So I bravely ventured out into the world. Alas! The storms of misfortune beset me. And I was blown to the snow-covered prison you call home. Here, I saw an opportunity. I could lead these poor penguins to prosperity!",other
@ByingtonJohnnie I cannot even begin to imagine what a thunderstorm of emotions you must be experiencing; just remember you’re never alone. Your Twitter family is always here for you.,other
"@So_damntired Used to love watching the lightning over the mountains during summer storms! Swimming was so much fun, and we spent a lot of time boating when we lived at Six Mile.",storm
"Space weather for the next 24 hours is predicted to be strong., 0
Geomagnetic storms reaching the G3 level are likely. (2022081804350203)",storm
"Space weather for the past 24 hours has been moderate., 1
Geomagnetic storms reaching the G2 level occurred., 1
Radio blackouts reaching the R1 level occurred. (2022081804350202)",storm
WeatherTalk: More humidity but fewer big storms https://t.co/xrSs3bKA2O,storm
@BoKnowsWeather This week will be beautiful thunderstorm heaven,storm
Not all Storms come to destroy your life; Some come to clear your Path…💐 # Good Morning,other
"Watch as our heroes go to an unknown planet Full of Forts and Storms. Will Shido Master the Kamehameha Wave in time for the Final Battle? More on this Episode of Dragon Ball Fortnite!, 0
#SmallStreamersConnect #twitchaffiliate #RazerStreamer, 0
https://t.co/1CmbZAcYQ9",other
"Low temps for tonight, 1  
Checkout  your Temps   Weather at https://t.co/HNLPnb8GMF , 1          
#wx #weather #cold  #nice #rain #storm #Freezing #lows #f g #temps #nws #usa #colder #cooling #news #heat #states  #weekday    earth
k storms https://t.co/N90b8dvbNz",storm
#Lightning | Know about the #Myths &amp; #Facts About #Lightning and #Thunderstorm. 👇 https://t.co/W4BypLVZKD,storm
"To try soothe those over active thoughts and calm the storm within as once you become a cancer patient they forget to tell you that you become a storm chaser or is it the storms chase you, be silent my racing mind calm waters will one day caress this shoreline https://t.co/F6B5zcdB45",other
"experienced a summer thunderstorm this evening for the first time in forever. the sky darkened, the wind picked up, the torrential downpour began, and it was over in 40 minutes. afterward we went to the park and i couldn’t stop looking at the sky’s underbelly of clouds",storm
NWS Alert&gt; Strong Thunderstorm Near Blackwater or 7 Miles W of Coolidge Moving SW At 15 MPH. Wind Gusts to 50 MPH. Gusty Winds Could Knock Down Tree Limbs &amp; Blow Around Unsecured Objects. Locations Impacted Include Casa... #azwx https://t.co/kaPOaYsZxT,storm
NWS Alert&gt; Strong Thunderstorm Near Blackwater or 7 Miles W of Coolidge Moving SW At 15 MPH. Wind Gusts to 50 MPH. Gusty Winds Could Knock Down Tree Limbs &amp; Blow Around Unsecured Objects. Locations Impacted Include Casa... #azwx https://t.co/r74snC8JET,storm
"@LindaBissett4 Now imagine that climate change gets worse than it is now. Crops are all burned, trees are gone. Air quality is worse than it has been since the 1800s. And the flooding and rapid storms have devastated every landmass and coastal cities are underwater...",storm
"@AmericanAir The storms started three hours in, unfortunately. So hard to accept this as the answer.",storm
Last one of the night ;) Cells developing as an outflow boundary moves north through DFW. McKinney and Farmersville storms as seen from Orangeville #dfwwx #txwx https://t.co/byQsRc5sGr,storm
"@nascarcasm @Dalton_Kellett Scientifically you can’t even begin since all tracks turn counter clockwise. Which is cyclonic flow in the northern hemisphere lifting air creating clouds, storms and rain. All storm systems spin counterclockwise or cyclonically.  😜",storm
"Very isolated storms Thursday, followed by cooler temps https://t.co/usyPQUfyKO",storm
@mizpiggy111 Our crew is out of sequence due to the storms that blew through DFW. We're sorry for the delayed start.,storm
"If outside during #thunderstorm &amp; lightning, avoid open structures/spaces. https://t.co/XLlRuZ4vGo",storm
@GerryDrobnicki I remember the Giambi GS during a raging rainstorm in extra innings.,other
I just drove through a gigantic thunderstorm for 1.5 hours of my 3 hour drive home and I am exhausted from being terrified of nature,storm
"2022 has lagged behind the prior year in named Atlantic storms, but tropical development is being monitored this week: https://t.co/diQ5eJrd4k https://t.co/JLCZXVIa9s",storm
"Oh, this is quite surprising response I never wished to witnsss, because I was persuming that we'd have similar view on yourself, lovely miss blondie. A captivating woman whose smile is like a glimpse of sun's ray for noxious thunderstorm to end. However, to answer your (cont)",other
"we will go back to fictional paradigms, 0
but expect storms",other
Shorter days and abnormal geomagnetic storms?!?!? Shits gettin weird thanks @CERN,storm
"Never lose hope, 0
Storms make people stronger and never last forever, 0
🔥🌹🔥🌹🔥🌹🔥, 0
#storm #hope #life https://t.co/4wmX6EmHHw",other
"ITS BECAUSE OF THEIR EXEMPLARY ENGINEERING THAT THE DELTA WORKS ARE KNOWN AS ONE OF THE SEVEN MAN MADE WONDERS OF THE WORLD. THEYRE A SERIES OF REENFORCED DYKES THAT CAN WITHSTAND STORMS THAT STATISTICALLY OCCUR ONCE EVERY 10,000 YEARS. WHEREAS THE NEW ORLEANS LEVEES CAN ONLY- https://t.co/SR2nagaqF9",other
"Style vs. Style: Wing Chun master storms Kyokushin karate dojo, 0

https://t.co/A0TGuUaf5k https://t.co/FTEVaVGvv3",other
"4 Will your eyes behold through the morning light, 0
the city of gold and the harbour bright?, 0
Will you anchor safe by the heavenly shore,, 0
when life's storms are past for evermore? [Refrain]",other
"1 Will your anchor hold in the storms of life,, 0
when the clouds unfold their wings of strife?, 0
When the strong tides lift, and the cables strain,, 0
will your anchor drift, or firm remain?",other
"WEATHER UPDATE- Pop up Showers Are still possible through Out the Over Night hours, Tommrow Morning... Some Showers &amp; Storms are expected to move through during the morning hours &amp; continue Into the afternoon hours with cooler Temps into the mid-lower 80! #dfwwx #txwx",storm
Storms on the coast? https://t.co/4zeXfJRmSG,storm
The storms approaching the Arpa Sardegna radar be like https://t.co/MJ5oO6uuBb,storm
I’m too amazing to not be with someone who won’t support me though the storms and the rainy days.,other
"The storms went around us again like usual,  but did get some pretty good shots of them. Tilbury 4:38p.m Aug.17th 2022. #ONStorm  #onwx #ckont @StormhunterTWN @IWeatherON @WE_SEE_ https://t.co/VIjmfbGsGj",storm
"Pretty much nailed it. , 0

One note.., 0

Big road game = Thunderstorm Troopers https://t.co/fNrQkTrJmi",other
"Rossbeigh during Monday’s storms. , 1
(It was nice for the gardens to get the rain.) , 0

Admittedly, only saw ONE ocean swimmer in Dingle Bay at the time 😉 , 0
8:45 pm. , 0
#glenbeigh #reeksdistrict #Ireland https://t.co/J91PzfZWoo",other
@barefoot_cas @Kamscan The storms and wind run SW to NE through there. Based on the smoke patterns over the last several years it does seem quite windy across that plateau during the summer days.,storm
"ᅠ
ᅠ
ᅠᅠᅠᅠᅠᅠᅠᅠᅠᅠ𝐈𝐍𝐅𝐎
ᅠᅠᅠᅠᅠᅠᅠᅠᅠᅠ ᴱᶰᵍˡᶤˢʰ

Valhir, or Volibear, is a freljordian God, responsible of the brutality of the storms, ruling with a single rule: There's no peace, nor time for family, everyone living under his faith is known for being savage+",other
"@MabesLeonisoul That is so freakin' cool!, 0

Stars...so need a cool insignia now...",other
@IAmSteveHarvey And… most importantly… trust &amp; have faith in God. That’s been our life for the last few months with the storms.,other
"Meanwhile.. the weather extremes scientists predicted., 1

https://t.co/A3DrWoRlEs",other
sorry to my dad who has to listen to my fall asleep to either rain storms or slowed + reverbed songs,other
THUNDERSTORM LETS GOOOO,storm
"Severe Thunderstorm Warning for the following counties/areas Roosevelt, Sheridan until 17 Aug 7:15PM MDT https://t.co/CCfeXFLbAy",storm
@Alexias77 @Truthseeker1985 @StaceyVansyoc Cars can accelerate when hydroplaning. Think of air hockey but you're car is sliding on water with the velocity and weight behind it. Depending on the angle it would accelerate before impact. It's weird. I had a hydroplane car accident on I-5 during a rainstorm.,storm
"Thunderstorm Advisory No. 1 #VIS_PRSD -Iloilo Radar, 1
Issued at 12:03 PM, Thursday, 18 August, 2022, 1

Moderate to heavy rainshowers with lightning and strong winds due to thunderstorms are affecting over #Capiz(Dumarao); #Iloilo(portion of Passi City) https://t.co/IgCTHMcE4P",storm
"Thunderstorm Advisory No.4 #MIN_PRSD, 1
Issued at 11:40 AM, Thursday, 18 August 2022, 1
Light to moderate to at times heavy rainshowers with lightning and strong winds affecting portions of #DavaoDeOro(Maco, Mabini), #DavaodelNorte (San Isidro, Talaingod, Kapalong, New Corella, Panabo",storm
"Thunderstorm Advisory No. 7 #VIS_PRSD - Bohol Radar, 1
Issued at 12:03 PM, Thursday, 18 August, 2022, 1

Moderate to heavy rainshowers with lightning and strong winds due to thunderstorms are expected over #Bohol(Loon, Tubigon, Calape, San Isidro) and nearby areas within  1 to 2 hours. https://t.co/wfcAYLtYbo",storm
"@TAKA_defspiral * Hug Hug *, 0
Good morning my GALAXY 💫, 0
How are you doing?, 0
Did you sleep good last night?, 0

Weather forecast here is going to be a thunderstorm today., 1
Woo~ thunder ⛈️, 1

Enjoy your day &amp; be safe na kha., 0

I love you everyday ❤︎, 0

Your 🌙 &amp; The Minis https://t.co/Vtli8W4Zxx",other
I’ve seen this before while watching storms approach me on radar… https://t.co/z0ElQOHTeC,storm
@cryptidcade Thunder storms cause I find them extremely calming and I love the flash of light and then BOOM,storm
@GroundTruthPics You can explore most past storms and their tracks here: https://t.co/Uw62Kg2zft,storm
@TJ_onfire @pancakehopper1 @KarenLynne2828 @ClassicUSMom @melJsaysso @StillHereBugger @chris_jolliff @LilaGraceRose It storming over there? I heard California's been getting hit with storms lately,storm
That nap earlier during that thunderstorm got my ass up 🙄,storm
"KANYE'S - Yeezy Helmet. How many people will walk around with these on, just to follow a fad., 0

Alaska winter storms I can understand, other than that 👀🤷🏽‍♂️ https://t.co/etEh4rZQEY",storm
Severe Thunderstorm Warning for the following counties/areas Maricopa until 17 Aug 5:30PM MST https://t.co/x1VZGotM8m,storm
"Thunderstorm Advisory | Issued at 12:03 PM, Thursday, 18 August, 2022, 1

Moderate to heavy rainshowers with lightning and strong winds due to thunderstorms are expected over #Bohol (Loon, Tubigon, Calape, San Isidro) and nearby areas within  1 to 2 hours. https://t.co/FoUjkH0AqQ",storm
"@reoisready I'm so sorry ;__; I've def been caught in a few scary storms, so I get it. Sending good vibes 🦈💕",storm
"Thunderstorm Advisory | Issued at: 11:20 AM,18 August 2022, 1

Moderate to Heavy rainshowers with lightning and strong winds are expected over Cavite, Laguna, Batangas, Nueva Ecija, Zambales, Bataan within the next 2-3 hours. https://t.co/YizYTcA65n",storm
@scottygod I forgot about Arizona dust storms,storm
"Thunderstorm Advisory | Issued at 11:40 AM, Thursday, 18 August 2022, 1

Light to moderate to at times heavy rainshowers with lightning and strong winds affecting portions of #DavaoDeOro(Maco, Mabini), #DavaodelNorte (San Isidro, Talaingod, Kapalong, New Corella, Panabo City... https://t.co/atu6yMUAY3",storm
"If outside during #thunderstorm &amp; lightning, avoid open structures/spaces. https://t.co/hRoaBh4ZAy",storm
"@sethacles Just had a sudden rainstorm in my kitchen last week, so you have my empathy.",other
"So today all night all ive been able to smell is the smell of the fires and even felt as if there was smoke here, we got some electrical storms and mild rain so luckily it might help. So dont worry we're keeping safe. Lets hope it gets under control soon. https://t.co/dlOq4On3vf",other
"Thunderstorm Advisory | Issued at 11:00 AM, 18 August 2022, 1

Moderate to a times heavy rainshowers with lightning and strong winds will be expected over #Romblon, #Masbate (Ticao island, San Francisco, Mulanay, San Andres)... https://t.co/LwxKupSVZw",storm
Stormy night in the city ❤️ #twincities #Minneapolis #Thunderstorm https://t.co/QkrCsA15Gq,storm
"@johnmitch59 Storms?, 0

Have a good night John! 🤠",other
Todays sketch. It was forecast to have a lot of storms today. But all we got was a little rain and storms east and north. Whew. https://t.co/BbHwUXKSeY,storm
"Weather Update: IMD predicts heavy rainfall, thunderstorm over east-central India, other parts - Check complete forecast here https://t.co/88i3tc6mSt",storm
"gn 🕺💤, 0
there was like a 5 min thunderstorm but all is calm now, 1
😴😴😴😴😴, 0
catch ya in the am",other
"First drought, now downpours as storms slam France, England https://t.co/oFBsBptCNg via @YahooNews",storm
Another spectacular CME heading towards Earth. Could spark some more geomagnetic storms. The small white circle in the middle indicates the size and position of the Sun. SOHO/LASCO C3. https://t.co/rrwnjVs3Sd,storm
@StormsJournal @artscouncil_ie @Fingalcoco @gaynorkane @walshprint Thrilled for the inclusion in The Storms 🌹,storm
"RT dost_pagasa: Thunderstorm Advisory No. 8 #NCR_PRSD, 1
Issued at: 11:20 AM,18 August 2022 https://t.co/mcDwYKUFrI",storm
"@ghiblipicture Here is a music video Rainstorm I created. It is a tribute to the wonderful films of Studio Ghibli.  , 0
https://t.co/G7XPUSM25p",other
"@ZullieTheWitch I, for one, really enjoy it, as long as it's only for one or two alternate types. Like even in Demon's Souls, the stonefang miners and the shrine of storms skeleton are the only ones you really have to think about switching that much.",other
"@LBC Welcome to our climate change World, Summer heat wave records, record Autumn storms and flooding and you got it worse to come.",storm
"Bows &amp; blades &amp; lasers, oh my! #postapocalypse #Paranormal #Romance, 0

Available on #kindle #apple #nook #sony #kobo #more, 0 

Coming soon to audio! Wind and Fire (Gathering of the Storms Book 1) https://t.co/510vukmgVS",other
Severe Thunderstorm Warning for the following counties/areas La Paz until 17 Aug 4:30PM MST https://t.co/q1sX1zXZ1W,storm
"⛈ Cleared: Severe Thunderstorm Warning ⛈ , 1

There are currently no areas under advisement for Severe Thunderstorm Warning.",storm
"Charge. The storms.Sail against tides.Succeed against the grain, and leaning into, 0
An empire there isn't ے⁦نون⁩- . The only loss    ك̷و̷د̶⁩ ⁦̸خ̷ص̸م̴⁩  .   is the best part https://t.co/ULbMja0JcK",other
"@ByJamesHartley @TarrantDemParty Big ass thunderstorm dropping a shit ton load of rain on Forth Worth , 1
The grass out front and back are happy, 0
The squirrel up in the tree is wet and pissed",other
"Tomorrow is another day, another commencement of another rainstorm. I may or may not show up. And I may lose some more of my strength. But I will try. I will always try., 0
#nikerunclub https://t.co/eVGWKW87pE",other
"#mbstorm 11:09p SEVERE THUNDERSTORM WATCH ENDED by Environment Canada, 1

Conditions are no longer favourable for the development of severe thunderstorms., 1

end/paspc, 1

Arborg - Hecla - Fisher River - Gypsumville - Ashern, 1
Grand Rapids - Waterhen, 1

https://t.co/LiT8i2KKC7",other
23:09 EnvCanada ended #Thunderstorm watch #GrandRapids #MBStorm https://t.co/SuO9G23YKe,storm
23:09 EnvCanada ended #Thunderstorm watch #FisherBranch #MBStorm https://t.co/a9177EMyfI,storm
Storms never last forever always remember that,other
France and Britain brace for storms after enduring drought and heat waves | News | DW https://t.co/zhswpUpEbW,storm
"Severe Thunderstorm Warning for the following counties/areas Gila, Maricopa until 17 Aug 5:45PM MST https://t.co/MMoHoee01H",storm
I always say I love thunder storms but the moment I hear thunder and loud wind my anxiety just 📈📈📈,storm
This first period of #aurora (over the last 6 hours) is likely the first of several storms that will be arriving at earth and juicing the magnetosphere over the next couple days. https://t.co/mqKV6uAM5F,storm
"Thanks everyone for coming even though my internet cut out due to thunderstorm. Thanks for the raid @OblivionNite even though I was ending lol. We raided @DaijoubuInumaki afterwards at , 1
https://t.co/VTmNkL4VgL https://t.co/BAI6aZTnBY",other
mmm… gotta love seeing fire danger warnings in the middle of a summer thunderstorm in the Pacific Northwest 🥲 https://t.co/eXjcGG4zP2,storm
@SnyderChilean @EdgarDzib1 Kingpin just storms in,other
"Severe Thunderstorm Warning for the following counties/areas Maricopa, Yuma until 17 Aug 7:30PM MST https://t.co/BV4R4aEQBl",storm
A Faire of Charoite and Dust Storms,other
"11pm Wednesday - Storms will continue to slowly decrease into the nighttime hours, but some heavy rain and lightning will remain in places. Severe storms are unlikely into the overnight hours. #wfaaweather, 1

Radars: https://t.co/ji6YaxLBma https://t.co/L5IQLqiL2y",other
"11pm Wednesday - Storms will continue to slowly decrease into the nighttime hours, but some heavy rain and lightning will remain in places. Severe storms are unlikely into the overnight hours. #wfaaweather, 1

Radars: https://t.co/PyKreFAs8D https://t.co/q0zifqVE4z",storm
World Series is back on!!! https://t.co/BKzVI6lqMR,other
@AmyCutlerNews I met you in Chapel Hill North Carolina during an interview welcome to Arizona I am here also enjoying the storms!!! Gilbert AZ https://t.co/oDSAUzzmnD,storm
"Some point storms, they
An empire there isn't ے⁦نون⁩- . The only loss    ك̷و̷د̶⁩ ⁦̸خ̷ص̸م̴⁩  .   is the best part https://t.co/K2TnarVTFD",other
HOLY FUCKING SHIT THERE'S A DAMN THUNDERSTORM GOING ON IN NEW YORK,storm
"Well I made another trip around the sun. Unfortunately I spent most of the day in bed with a migraine &amp; crazy storms all evening that keeps knocking the power out. But I'm on this side of the grass, so I'm very blessed. Here's to being 54!",storm
"We have gotten nada in my little part of NE Dallas. Light show from the storms all around us, but not a drop.",other
"Gatwick has been forced to cancel dozens of flights as storms continue to batter Britain, 1
https://t.co/f2XggaT6q4",other
"Gatwick has been forced to cancel dozens of flights as storms continue to batter Britain, 1
https://t.co/1arUVbG1Lw",other
