text,category
Spending this summer thunderstorm on the porch with some whiskey. This is nice.,storm
"through  storms  and  rains  ,   deserts  and  seabeds  ,   suns  and  moons  .",storm
NIGHTTIME THUNDERSTORM!!!!!!,storm
A few clouds but quiet overnight with lows in the low 70's. Increasing clouds with showers &amp; storms likely on Thursday &amp; Friday.  https://t.co/p4BJeMN606 https://t.co/4SpzaToMH6,storm
@scotthetsko Anthother day no rain in Greece  did chase a few storms tho today like Leroy area https://t.co/7XTvz7hBr0,storm
There's nothing like a good Texas thunderstorm to calm the nerves.,storm
"I Am Charlie Chap the WonderCat!! ❤️😺 #charliechaptwc #cuteandsassy #tuxedofeatures #kitty #cutebaby #petsofinstagram #catsofinstagram #ilovemycat #softkitty #tuxiesofinstagram #rescuecat #chonkycat #cats #crazycatlady #catlife #CatsOfTwitter #CatsOnTwitter,0 
#thunderstorm https://t.co/sTbguDHSAZ",storm
"Wow - The power of water. Thinking of the people of Devenish Pl and the Tasman and Westland regions. A big, big cleanup ahead. https://t.co/pg9hWGdZ61,1
#camexcivil #drainage #civilconstruction #teamwork",other
"#𝐎𝐂𝐂 : ,0

This thunderstorm is garbage… https://t.co/YjkwfGr16K",storm
Storms in Tolar leave behind extensive damage https://t.co/Y6kUgI0VBP,storm
Need a good thunderstorm,storm
Finally got some rain and it’s a thunderstorm too!! https://t.co/EV6hUSwbPC,storm
TWC expires Severe Thunderstorm Warning for Pima [AZ] https://t.co/ZYYru1W7fz https://t.co/nZnbdBDzvf,storm
TWC expires Severe Thunderstorm Warning for Pima [AZ] https://t.co/7SThPI6rI5 https://t.co/iU43VcZIBJ,storm
TWC expires Severe Thunderstorm Warning for Pima [AZ] https://t.co/ZLyCnekenj https://t.co/Mq4UCMCqmA,storm
TWC expires Severe Thunderstorm Warning for Pima [AZ] https://t.co/WhT6kfzmEh https://t.co/Z9Hgr7XRcJ,storm
@Mobilizesxd @hourly_shitpost song of storms from LoZ:OoT,storm
"@KevinBattle Sorry... I forgot this one...,0

Not every storm comes to disrupt your life...  Some storms come to clear your path.",other
"Storms make trees take deeper roots.🏃🏻🔥💪🏻,0
#𝐷𝑎𝑒𝑙𝑢𝑐𝑖𝑓𝑒𝑟 🐺 https://t.co/ayhHa20ZuY",other
"Sitting on the porch, watching the first thunderstorm of the season, drinking wine.,1

The rain smells amazing.,1

It’s the simple things, really.",other
7:35 PM Update: A general trend of dissipating thunderstorms all over our area. Some storms to the west are stationary which will enhance the flood risk in those areas. Casa Grande will get some rain from the storm that created the dust storm. #azwx #cawx https://t.co/DwOIOnmYiF,storm
Are these storms telling us summer is over? 🤞🏼🤞🏼,storm
"View of the storms around Ferris and Walnut Springs, TX all the way up in Orangeville :) #dfwwx #txwx https://t.co/URT6iRBnEV",storm
we love a late-night thunderstorm,storm
"Sorry to end the stream early guys, between the thunderstorm and me being extremely tired. I think nature has bested me this once.",storm
Thinking about buying a gun to protect me from this scary thunderstorm,storm
"@OP_NEWS2022 @OP_NEWS2022_2 If that thunderstorm hint don't show up in this chapter,,0
I am booking a fight with redon😮‍💨 https://t.co/fr9vkcakT3",other
"God will not allow a trial to come into your life unless He has a purpose. He doesn't send the storms, but He uses them.",other
CTV Skywatch Weather Alert: A Severe Thunderstorm Watch or Warning is in effect for the regions below. #mbstorm Details: https://t.co/vnkYyFXgaa https://t.co/iA02gG9Kzj,storm
"% Minato-city : Advisory %,1
-Rescission-  Heavy rain,1
{Continuation}  High waves, Gale, Thunderstorm,1
 (2022-08-18 11:34 ),1
#MinatoCity",storm
"This is why I said Courtney should’ve chosen Sam instead of Chad from Casa. Chad is giving little boy vibes. If your girl storms off from you, you go after her. Instead Chad went behind her back and is claiming he’s open just to spite her 🙄 #LoveIslandUSA https://t.co/0l9KNfpAAk",other
A bunch of planes circling waiting to land at DFW in a thunderstorm but I don't understand why there's a plane in that pattern on a Cancun to Austin flight plan? https://t.co/fwoQCum9UL,storm
@Berkiiel One of my favorite things about Texas. Watching thunder storms roll in will never get old,storm
"Space weather for the next 24 hours is predicted to be strong.,1
Geomagnetic storms reaching the G3 level are expected. (2022081802350203)",storm
"Of course the rain didn't move in gently, it arrived in a noisy gush that has Pepper in her #Thundershirt and following me around the house. #DogsOfInstagram #Thunderstorm #Drought #WeNeedRain #NoMoreTripleDigits https://t.co/pgQXQSWip0",other
"Space weather for the past 24 hours has been moderate.,0
Geomagnetic storms reaching the G2 level occurred. (2022081802350202)",storm
"Severe Thunderstorm Warning for the following counties/areas Clay, St. Johns until 17 Aug 7:00PM EDT https://t.co/6ki4in5fSr",storm
"Getting enough sleep for the marginal risk for severe storms &gt; staying up all night for northern lights.,1 

I wake up before the sun does so maybe I will still sneak a peak. https://t.co/DWv5z1zfmV",other
"So a thunderstorm came by and caused our power to go out and thay caused my computer to turn off, when I turned it back on I kept getting this (I've already restarted it and turned it off multiple times) and idk how to fix it https://t.co/Qa7GKM1Jw2",storm
CTV Skywatch Weather Alert: A Severe Thunderstorm Watch or Warning is in effect for the regions below. #mbstorm Details: https://t.co/vnkYyFXgaa https://t.co/DBZcOOJcfe,storm
i love when it storms. 🥺,storm
Rain and storms Thursday! #KALB #LAWX #barrett_wx https://t.co/OXpER0Ed20,storm
"First drought, now downpours as storms slam France, England https://t.co/Pc9t5M1flt",storm
"From no rain for almost three months, to an extreme thunderstorm that is shaking the whole damn house.,1

...,0

This planet is fucked.",other
This thunderstorm is straight ASMR,storm
"#mbstorm 9:33p SEVERE THUNDERSTORM WARNING ENDED by Environment Canada,1

Updated or ended by 11:32PM.,1

At 9:33PM, EC meteorologists are tracking a severe thunderstorm capable of producing strong wind gusts, up to nickel size hail &amp; heavy rain.,1

This...,0

https://t.co/tTI0lzyWUi",other
Severe Thunderstorm Warning updated for Southern Manitoba by Environment Canada at 9:33 PM CDT https://t.co/OiIvBOXywX,storm
"Stopping in Dallas for the night on my way back home from the Permian Basin. There's a severe thunderstorm happening outside, but inside I've got a #HotTubTimeMachine https://t.co/W2NalMNWFV",storm
My family is country asf and I’m a city girl (🤪) but I can smell rain before a storm and I LOVE the smell after a big rainstorm https://t.co/Rdajti4ARS,storm
@Garr66957564 @FoJAk3 Just regular solar storms chance of northern lights tho,storm
"Gendry, legitimized heir of Robert Baratheon, lord of storms end, not even mentioned as being in contention for the iron throne in the end…. FOOLERY",other
"Love isn't always safe winds, smooth sails &amp; #savvy shores,,0
At times, it blooms in the wild winds while breathing in the storms,0
But this time,0
I'm letting the waters of the Universe flow,0
Not fighting even a tide of life,0
I feel weak in my bones,0
I can't fight the fate alone,0
#vss365",other
"@CSurvivor9 I’ve seen this before! Hysterical! But I’ve got a crazy cat who loves going out and playing in the rain; day or evening! Unless it’s a thunderstorm, and then I don’t let him out in that. Tiger loves playing in water!🐯🤣",other
"And yet, there's storms, and great tornados, natural phenonema like these always made me happy, when everyone else was hiding, i wish i could fly and see closely as the storm unraveled, the sun rays mixed with the now fast paced clouds, sometimes these clouds obscuring it all.",storm
@OP_NEWS2022 @OP_NEWS2022_2 what happened to the shocking last panel and the thunderstorm hint 😭,storm
when it hasn't rained in months so u  go play in da thunderstorm...just texas tings https://t.co/yEOpvMfSz6,storm
"Coming in from the south! These storms are developing behind a north-moving boundary, but the cells are moving toward the south. #dfwwx #storms https://t.co/7roLMpZJpv",storm
"A STRONG THUNDERSTORM WILL IMPACT PORTIONS OF SOUTHERN KIDDER, NORTHWESTERN LOGAN AND NORTHEASTERN EMMONS COUNTIES THROUGH 1000 PM CDT [wind: 55 MPH, hail: 0.00 IN] https://t.co/tREXmjfON9 https://t.co/Ki1EQeV2Dx",storm
The calm before the storms: Why 2022's hurricane season won't stay quiet much longer https://t.co/18SSKCG7fh,storm
A surge of moisture from a tropical rainstorm that brought torrential rainfall to Texas this past weekend and Monday will continue to spread into the interior Southwest through this upcoming weekend: https://t.co/SxbTpi5nTA,storm
This thunderstorm ain’t playing,storm
@ImJust_AnOther Thank you ^^,other
@Shadumura Awww...thank you Sugah Sabes,other
"Severe Thunderstorm Warning continues for La Paz County, AZ, Yuma County, AZ until 7:45 PM MST https://t.co/hXkJlKRa4e",storm
"Severe Thunderstorm Warning continues for La Paz County, AZ, Yuma County, AZ until 7:45 PM MST https://t.co/OXxlOwYdeO",storm
NORTH METRO #MNWX #thunderstorm #tstorm https://t.co/E92gLgeH7h,storm
"PSR continues Severe Thunderstorm Warning [wind: 60 MPH (RADAR INDICATED), hail: &lt;.75 IN (RADAR INDICATED)] for La Paz, Yuma [AZ] till 7:45 PM MST https://t.co/tvQem6rvln https://t.co/JOYcIh2oeK",storm
"PSR continues Severe Thunderstorm Warning [wind: 60 MPH (RADAR INDICATED), hail: &lt;.75 IN (RADAR INDICATED)] for La Paz, Yuma [AZ] till 7:45 PM MST https://t.co/Rskr1aTU97 https://t.co/jAakFIlCJn",storm
"PSR continues Severe Thunderstorm Warning [wind: 60 MPH (RADAR INDICATED), hail: &lt;.75 IN (RADAR INDICATED)] for La Paz, Yuma [AZ] till 7:45 PM MST https://t.co/awUEreShlv https://t.co/rMv24KmJVS",storm
"PSR continues Severe Thunderstorm Warning [wind: 60 MPH (RADAR INDICATED), hail: &lt;.75 IN (RADAR INDICATED)] for La Paz, Yuma [AZ] till 7:45 PM MST https://t.co/b0mjUcB80B https://t.co/zjTJUCrxAn",storm
"PSR continues Severe Thunderstorm Warning [wind: 60 MPH (RADAR INDICATED), hail: &lt;.75 IN (RADAR INDICATED)] for La Paz, Yuma [AZ] till 7:45 PM MST https://t.co/zfAFKvA3TA https://t.co/amtMETvwZt",storm
need to hear his voice rn. it’s storming n i fucking hate sleeping during storms 😡,storm
Warming up Thursday with a few storms; then not as warm with sunshine Fri&amp;Sat https://t.co/ZbPMCXU66y,storm
"#FirstAlertDFW update at 9:30PM - Chief Meteorologist @ScottPadgettCBS is tracking a Severe Thunderstorm Warning in effect for Dallas &amp; Tarrant Counties.,1

He'll have the latest on severe weather in North Texas on CBS 11 News at 10: https://t.co/a70Ye7wIF1 https://t.co/mCPmtnvLyH",storm
@diparamakrishna @praddy06 @ChennaiRains @RainStorm_TN Which part of Chennai?,storm
@DIVINGAV8TRIX Valerie I sent a photo of this to our town supervisor. Would be really nice to have this at our town park/ beach. Was this a permanent structure or do the put it down during the season. With our weather/storms not sure we could do something like this,storm
It’s getting cooler outside and a storms a brewin,storm
why yes i am watching a thunderstorm roll in https://t.co/F5ZqHbNrP8,storm
NWS Alert&gt; Strong Thunderstorm Near Livingston Moving SE At 15 MPH. Winds Over 30 MPH &amp; Large Hail. Gusty Winds Could Knock Down Tree Limbs &amp; Blow Around Unsecured Objects. Minor Damage to Outdoor Objects is Possible. Locations... https://t.co/Aa9bqLpdFq,storm
Storms brewing @NWSFortWorth https://t.co/mSd57YMPWo,storm
@4k8bit @107O7 @ddrpy I WAS JUST LOOKING THE WORD THUNDERSTORM UP,storm
@SamanthaKolber I loved the black room in high school! I miss film photography days! (I do NOT miss bungling the processing and losing good photos to my film sticking together in the processing canister…),other
"A strong thunderstorm will impact portions of central San Jacinto and southern Polk counties through 1000 PM CDT [wind: 30 MPH, hail: 0.88 IN] https://t.co/1yQ5w2dH9C https://t.co/C7xxQaxIl5",storm
"Severe Thunderstorm Warning for the following counties/areas Maricopa, Pinal until 17 Aug 7:00PM MST https://t.co/g8llO1kAcB",storm
Severe thunderstorm warning 😍😍 can’t wait https://t.co/fT6ka6mL38,storm
"You trace choices, right or wrong. Storms just, 1
!!,0
,0نمشے

🔹W77🔹,0
🔹W77🔹",other
The cool fan and thunderstorm is the perfect combo to sleep rn 🙏💗,storm
Absolutely love Florida Summer storms. #Lightning https://t.co/jcZdBWYQvw,storm
These massive storms were having right now. Amazing. Well. I wish it did cut out my wifi. But other than that. https://t.co/K4OVI1eXr7,storm
Storms NW of Minneapolis https://t.co/9hholxEqCM,storm
"📡⛈️🌜 7:30pm Radar Update: A couple lines of storms moving SW this evening, one of those over the Tucson metro. They are moving at roughly 15mph and are bringing brief heavy rainfall, localized flooding, and gusty winds. Stay alert this evening if you are out and about! #azwx https://t.co/1S2wxBylnN",storm
"⛈ New Severe Thunderstorm Warning ⛈ ,1

A thunderstorm producing hail one inch or larger in diameter and/or winds equal or exceed 58 miles an hour has been reported. People in the affected area should seek safe shelter immediately. https://t.co/B5M9QR8h4Z",storm
CTV Skywatch Weather Alert: A Severe Thunderstorm Watch or Warning is in effect for the regions below. #mbstorm Details: https://t.co/vnkYyFXgaa https://t.co/pMvxQL0S39,storm
"Thunderstorm Advisory No. 2 #VIS_PRSD - Bohol Radar,1
Issued at 10:14 AM, Thursday, 18 August, 2022,1

Moderate to heavy rainshowers with lightning and strong winds due to thunderstorms are expected over #Bohol(Mabini, Alicia, Ubay) and nearby areas within  1 to 2 hours. https://t.co/1CBCHS702G",storm
Should we start naming geomagnetic storms? 🤔,storm
"Thank you Paul, Ian, and Stanley for the late night work tonight after the storms.  We painted the soccer and football field tonight for our scrimmages the next two days.  #Teamwork #NoExcuses https://t.co/e2glsnMLIO",storm
"There's a Marginal Risk (Level 1) for severe storms for portions of Nebraska Thursday.,1 

I talked about it in detail in the video below!,0

https://t.co/WMsxSqBuOa https://t.co/OoayfOIgQP",other
normalize smoking a cigarillo on your front porch during a thunderstorm,storm
THE best thunderstorm of the year and the child AND the puppies are snoozing comfortably.,storm
"Looking south at the South Dallas County storms from Frisco, Texas. @KyleWeather @JesseWFAA @marielruizwx @wfaaweathertoo @GregFieldsWX @NWSFortWorth https://t.co/eWsckmkzLW",storm
Holding my sleeping child during a thunderstorm is one of the purest joys I've ever experienced.,storm
Severe Thunderstorm Warning for the following counties/areas Maricopa until 17 Aug 6:00PM MST https://t.co/pzhtlMJxYm,storm
Severe Thunderstorm Warning for the following counties/areas Pima until 17 Aug 5:00PM MST https://t.co/axsCpkRdDL,storm
Storms May Develop This overnight But there is no guarantee stay weather aware!,storm
Summer storms ⛈ &gt;&gt;&gt;&gt;&gt;,storm
Wicked lightning in a growing cluster of storms across the southern side of N Texas tonight.. #FirstAlertDFW @CBSDFW https://t.co/Wl8bnF1zyr,storm
"NWS Alert&gt; Severe Thunderstorm Near Grand Prairie, Nearly Stationary. 60 MPH Wind Gusts. Expect Damage to Roofs, Siding, &amp; Trees. Locations Impacted Include Dallas, Arlington, Grand Prairie, Mansfield, Desoto, Cedar Hill... #txwx https://t.co/rWYQePnX3F",storm
"NWS Alert&gt; Strong Thunderstorm Over Kennedale Moving N At 10 MPH. Wind Gusts to 50 MPH. Gusty Winds Could Knock Down Tree Limbs &amp; Blow Around Unsecured Objects. Locations Impacted Include Fort Worth, Arlington, Mansfield... #txwx https://t.co/JrN2J2KgOa",storm
"NWS Alert&gt; Strong Thunderstorm Over Ferris or Near Red Oak Moving N At 15 MPH. Wind Gusts to 50 MPH. Gusty Winds Could Knock Down Tree Limbs &amp; Blow Around Unsecured Objects. Locations Impacted Include Dallas, Lancaster... #txwx https://t.co/w6XwY8sF7j",storm
Amazed at the fact that the only time I tweet about streaming I get stuck at work bc of a thunderstorm https://t.co/9zjx67HWo7,storm
"If we want any rain this week, Thursday will have to be the day.  A cold front will trigger some scattered storms after four o' clock into the early evening.  One or two could produce some strong winds.  Storms will not be too widespread., unfortunately. #newx https://t.co/mH1DFDVM5o",storm
"🟡 ⛈️ Thunderstorm , Current Temp: 90° // Chance of precipitation 83%. Breezy, with wind speeds of 15 MPH. // Traffic destined *TO DFW* Airport is currently being delayed at its departure point 👙 | 09:24 PM |",storm
"First drought, now downpours as storms slam France, England https://t.co/nSbiWmraSH https://t.co/GLqbpzEjP3",storm
Dang crazy. It's like who would of thought ignoring environmentalists at the time that people were going to tap rivers too hard is bad we're right all this time. Can't wait for the acrid dust!! Whooo!!! When the Owens lake dust storms become more common in more places we all pay,storm
wanna do movie with kit connor so bad but I know i'd fall (more) in love with him 😭😭😭,other
@POCO_bob @RyanVoutilainen @BCWeather101 @ensembleator @jayakerley @JWagstaffe @50ShadesofVan Rain is good storms are not,storm
Nothing like blasting @TBSOfficial while speeding down the highway toward a massive thunderstorm to make the 30 year old emo kid in you feel ALIVE.,storm
@NWSTwinCities lightning from the distant thunderstorm visible from Chanhassen! #mnwx https://t.co/9x2pivxbD1,storm
"@naturetechfam @59NationalParks @AliceLFord While camping in Shenandoah, the fly on our kids' tent was blown off in the middle of the night during a rainstorm. Luckily our other tent stayed intact (&amp; kids' duffle bags were inside) so we all huddled in there. Also, we had hail/ice on the Beartooth Hwy - slow &amp; scary drive. https://t.co/KkdEdTLfxM",storm
CTV Skywatch Weather Alert: A Severe Thunderstorm Watch or Warning is in effect for the regions below. #mbstorm Details: https://t.co/vnkYyFXgaa https://t.co/eFnj7aVkQr,storm
"“with any rainstorm comes a rainbow babe 🤍” - danielle, ily 💌",other
@Autumns_Storms Cute!,other
"#mbstorm 9:23p SEVERE THUNDERSTORM WARNING ENDED by Environment Canada,1

Updated or ended by 11:22PM.,1

At 9:23PM, EC meteorologists are tracking a severe thunderstorm capable of producing strong wind gusts, up to nickel size hail &amp; heavy rain.,1

This...,0

https://t.co/kH5rccXldi",other
"NWS Alert&gt; Severe Thunderstorm Near Grand Prairie, Nearly Stationary. 60 MPH Wind Gusts. Expect Damage to Roofs, Siding, &amp; Trees. Locations Impacted Include Dallas, Arlington, Grand Prairie, Mansfield, Desoto, Cedar Hill... #txwx https://t.co/sLx9zhuoeP",storm
Severe Thunderstorm Warning updated for Southern Manitoba by Environment Canada at 9:23 PM CDT https://t.co/9m4fW0U8xH,storm
"NWS Alert&gt; Severe Thunderstorm Near Grand Prairie, Nearly Stationary. 60 MPH Wind Gusts. Expect Damage to Roofs, Siding, &amp; Trees. Locations Impacted Include Dallas, Arlington, Grand Prairie, Mansfield, Desoto, Cedar Hill... #txwx https://t.co/OiDDIoQpPx",storm
Heck of a light show going on from the storms in south Dallas right now. @NWSFortWorth #txwx https://t.co/8rrNE8UTC5,storm
"Severe Thunderstorm Warning continues for Grand Prairie TX, DeSoto TX and  Cedar Hill TX until 9:45 PM CDT https://t.co/INqBLnBJds",storm
"FWD continues Severe Thunderstorm Warning [wind: 60 MPH (RADAR INDICATED), hail: &lt;.75 IN (RADAR INDICATED)] for Dallas, Tarrant [TX] till 9:45 PM CDT https://t.co/H6taamGTvk https://t.co/8N3PnCATh2",storm
"FWD continues Severe Thunderstorm Warning [wind: 60 MPH (RADAR INDICATED), hail: &lt;.75 IN (RADAR INDICATED)] for Dallas, Tarrant [TX] till 9:45 PM CDT https://t.co/27dUN3ukcH https://t.co/XAn02YQeW4",storm
"FWD continues Severe Thunderstorm Warning [wind: 60 MPH (RADAR INDICATED), hail: &lt;.75 IN (RADAR INDICATED)] for Dallas, Tarrant [TX] till 9:45 PM CDT https://t.co/5eeB56NFtL https://t.co/OVNVyMOdIc",storm
"FWD continues Severe Thunderstorm Warning [wind: 60 MPH (RADAR INDICATED), hail: &lt;.75 IN (RADAR INDICATED)] for Dallas, Tarrant [TX] till 9:45 PM CDT https://t.co/KupTWEPlxG https://t.co/kcw7RPFHdo",storm
"FWD continues Severe Thunderstorm Warning [wind: 60 MPH (RADAR INDICATED), hail: &lt;.75 IN (RADAR INDICATED)] for Dallas, Tarrant [TX] till 9:45 PM CDT https://t.co/qtuGLh9iSn https://t.co/DZLSgYUC9g",storm
"FWD continues Severe Thunderstorm Warning [wind: 60 MPH (RADAR INDICATED), hail: &lt;.75 IN (RADAR INDICATED)] for Dallas, Tarrant [TX] till 9:45 PM CDT https://t.co/GMvn1oGNpc https://t.co/q9CF49VNKB",storm
"FWD continues Severe Thunderstorm Warning [wind: 60 MPH (RADAR INDICATED), hail: &lt;.75 IN (RADAR INDICATED)] for Dallas, Tarrant [TX] till 9:45 PM CDT https://t.co/XXTciD67LK https://t.co/rwBguEIwWl",storm
"FWD continues Severe Thunderstorm Warning [wind: 60 MPH (RADAR INDICATED), hail: &lt;.75 IN (RADAR INDICATED)] for Dallas, Tarrant [TX] till 9:45 PM CDT https://t.co/FezQxx8Wz7 https://t.co/rxUY2E9zvC",storm
"FWD continues Severe Thunderstorm Warning [wind: 60 MPH (RADAR INDICATED), hail: &lt;.75 IN (RADAR INDICATED)] for Dallas, Tarrant [TX] till 9:45 PM CDT https://t.co/bMonLbz8UE https://t.co/DSOc4XSXvt",storm
"FWD continues Severe Thunderstorm Warning [wind: 60 MPH (RADAR INDICATED), hail: &lt;.75 IN (RADAR INDICATED)] for Dallas, Tarrant [TX] till 9:45 PM CDT https://t.co/hd7uQx4NRN https://t.co/UX58YcZVbz",storm
"FWD continues Severe Thunderstorm Warning [wind: 60 MPH (RADAR INDICATED), hail: &lt;.75 IN (RADAR INDICATED)] for Dallas, Tarrant [TX] till 9:45 PM CDT https://t.co/G4vdWSm3jC https://t.co/7u6mCTLwND",storm
"FWD continues Severe Thunderstorm Warning [wind: 60 MPH (RADAR INDICATED), hail: &lt;.75 IN (RADAR INDICATED)] for Dallas, Tarrant [TX] till 9:45 PM CDT https://t.co/xB6nFz2MmZ https://t.co/6PsDSr1Nep",storm
"FWD continues Severe Thunderstorm Warning [wind: 60 MPH (RADAR INDICATED), hail: &lt;.75 IN (RADAR INDICATED)] for Dallas, Tarrant [TX] till 9:45 PM CDT https://t.co/onQSSYWz5m https://t.co/eO0smypS9g",storm
"Raise your hand if you love thunder storms. ,1

Me: ☆(ﾉ◕ヮ◕)ﾉ*",other
Makin tacos over a campfire with a rapidly approaching thunderstorm ✌,storm
"Tonight seems like the perfect night for storms and rain, doesn't it?",storm
"We’ve got some weather moving in to #southlake TX…⛈⚡️ ,1
I could watch this all night! 😍#tarrantcounty @wfaa @wfaaweathertoo #southlaketx #texas #Lightning #thunder #Thunderstorm #thunderstorms https://t.co/fHinFQijVy",storm
"NWS Alert&gt; Strong Thunderstorm Near Paloma or 49 Miles W of Gila Bend Moving SW At 20 MPH. Winds Over 40 MPH. Gusty Winds Could Knock Down Tree Limbs &amp; Blow Around Unsecured Objects. Locations Impacted Include Tacna, Sent... #azwx https://t.co/hcpH484tyn",storm
"@Souza101Matt can still get development in September, even with the vertical motion not being the most favorable. Likely would lead to smaller storms, however",storm
"PSR expires Severe Thunderstorm Warning for Maricopa, Yuma [AZ] https://t.co/sllJpelJ22 https://t.co/UkC3NrWdFO",storm
"PSR expires Severe Thunderstorm Warning for Maricopa, Yuma [AZ] https://t.co/Xcz6733bNY https://t.co/tQJa5Zzk4u",storm
"PSR expires Severe Thunderstorm Warning for Maricopa, Yuma [AZ] https://t.co/xOopSHO6eo https://t.co/QKir0mamJS",storm
"PSR expires Severe Thunderstorm Warning for Maricopa, Yuma [AZ] https://t.co/HQq48qeXEt https://t.co/LaMvJPSJZF",storm
"PSR expires Severe Thunderstorm Warning for Maricopa, Yuma [AZ] https://t.co/suLjqhyI2W https://t.co/yxwEmd10E8",storm
"After months of hardly any rain, and definitely no storms, the pets must have forgotten what thunder sounds like. No room on my lap tonight.",storm
Comment Fr de maman « what do you mean? The radar says there’s nothing in the area! BZZZZZT #ROANOKE #DENTON #AFW #thunderstorm Cc @NOAA / @NWSFortWorth / #iphone13 #5mm #af https://t.co/6F88VD0n7F,storm
"A strong thunderstorm will impact portions of east central Yuma and Maricopa Counties through 800 PM MST [wind: 40 MPH, hail: 0.00 IN] for Gila Bend, Gila River Valley, Kofa, Southeast Yuma County [AZ] https://t.co/WQpYQ4f4O4 https://t.co/rqcfhzSGRa",storm
Driving this 16ft rental today and hit a thunderstorm just west of Cisco. Thought it was going to lay me over for a minute. I’m sure had wheels off the ground for a second. Don’t remember the last time something scared me that much.,storm
"@callmepso Here's this month's lightning map which shows intense thunderstorm activity in the northern Nigeria, especially in Jigawa. Read and share these outdoor lightning safety tips to help others. https://t.co/AEXXtduf1u",storm
I love u https://t.co/7ymzyEbShl,other
Texas be playing  in our face all we asked for was rain tf is a “dry thunderstorm”,storm
Thunderstorm’s 🌩,storm
there’s a thunderstorm outside and my neighbor not home and his dog just in the backyard terrified 🙁,storm
"Expect to see some fog overnight if your out and about. Always use caution while driving in foggy conditions and maintain slower speeds. Otherwise, a pleasant day can be expected for Thursday, while thunderstorm chances come back into the picture for Fri./Sat. Stay safe! https://t.co/QXlrfP9Buy",storm
love me some late night rain storms ☔,storm
@elonmusk @ashleevance Fan friction and thought Elon was talking about Jupiter storms as a way for the atmosphere to release energy. As the water vapor condenses it releases heat warming the central planet. But wrong and wasted brain cells reading babble written by a fan? https://t.co/ouCXGxjRNs,other
"The Tolar Independent School District has delayed opening tomorrow, Aug. 18, because of the storms. https://t.co/xwttl3If5i",storm
2nd EAS severe thunderstorm interruption rude to interrupt Maria talking ..quarter size hail.,storm
